id,date,text
obama_1_0,2023-03-31 00:00:00,Our @ObamaFoundation leaders are working to protect trans rights and those in the LGBTQIA+ community around the wor… https://t.co/VDe3ua1Jli
obama_1_1,2023-03-31 00:00:00,"On this Transgender Day of Visibility, Michelle and I want every trans person in America"
obama_1_2,2023-03-28 00:00:00,"Grateful to all the first responders and volunteers working to help those impacted by the Mississippi tornadoes.

I… https://t.co/IP62KjaItV"
obama_1_3,2023-03-27 00:00:00,"We are failing our children. Guns are now the leading cause of death for children in the U.S.

Michelle and I mourn… https://t.co/fq5MeqqtWo"
obama_1_4,2023-03-23 00:00:00,"I hope their stories inspire you to help us protect the Affordable Care Act, so Americans everywhere can continue t… https://t.co/GWMbUaTsmA"
obama_1_5,2023-03-23 00:00:00,"To celebrate the 13th anniversary of the Affordable Care Act, @POTUS and I surprised some folks whose lives have be… https://t.co/qsTsgWxTZ6"
obama_1_6,2023-03-23 00:00:00,"I know so many of you have a story of how access to health care changed your life, in big ways or small. 

At the… https://t.co/GsUkT0LqP6"
obama_1_7,2023-03-23 00:00:00,"Since 2010, the ACA has provided more than 40 million Americans access to health care, expanded Medicaid to 40 stat… https://t.co/okTTxeVdbe"
obama_1_8,2023-03-23 00:00:00,"Thirteen years ago today, I signed the Affordable Care Act into law.

The night the ACA passed was incredibly meani… https://t.co/IzbDDwpEPD"
obama_1_9,2023-03-22 00:00:00,"At the @ObamaFoundation, we’ve been working to support the next generation of leaders tackling this issue, many of… https://t.co/A7IQ38Hz9s"
obama_1_10,2023-03-22 00:00:00,It's also important to note that @POTUS and his administration have taken historic steps that move us closer than b… https://t.co/RzbIms0pDL
obama_1_11,2023-03-22 00:00:00,The impacts of climate change are why we pushed so hard for the Paris Agreement during my time in office
obama_1_12,2023-03-22 00:00:00,This week's climate report from the IPCC is an urgent reminder of the limited window we have to deal with the clima… https://t.co/ldyneVI1b9
obama_1_13,2023-03-21 00:00:00,".@BChesky, @MichelleObama, and I created The Voyager Scholarship to support the next generation of leaders looking… https://t.co/jrjDEpS50m"
obama_1_14,2023-03-21 00:00:00,"And if you’re looking for ways to help out in your community, sign up to volunteer with @WisDems. https://t.co/ZIhxkfsYmq"
obama_1_15,2023-03-21 00:00:00,"Today is the first day of early voting in the Wisconsin Supreme Court election. It's going to be close, so don’t wa… https://t.co/XIaNSKOCTz"
obama_1_16,2023-03-19 00:00:00,Here’s an example of a smart policy that gets rid of unnecessary college degree requirements and reduces barriers t… https://t.co/TkO99uSuUf
obama_1_17,2023-03-17 00:00:00,"From the O’Bama family to yours, Happy St. Patrick’s Day! https://t.co/MmoHRpisAv"
obama_1_18,2023-03-15 00:00:00,"It’s the best time of year! My #MarchMadness brackets will get busted soon enough, but here are my picks. 

Who do… https://t.co/cCirFMHD1B"
obama_1_19,2023-03-15 00:00:00,"RT @ObamaFoundation: “Change starts when ordinary people decide they’re going to do extraordinary things.”

Listen to @BarackObama's moving…"
obama_1_20,2023-03-15 00:00:00,"RT @POTUS: I signed into law the most significant gun safety reform in nearly three decades.
 
But Congress must do more.
 
Let’s pass univ…"
obama_1_21,2023-03-13 00:00:00,"I'm incredibly proud and inspired by @BSW5020 and @Sabrevaya, their family, and the movement they've brought together to fight ALS. They've taken an incredibly challenging moment and are driving change. And they're not done yet."
obama_1_22,2023-03-10 00:00:00,"For Women's History Month, I wanted to share the stories of Cary and Sharika"
obama_1_23,2023-03-10 00:00:00,.@DemRedistrict hasn’t just been fighting for fair maps
obama_1_24,2023-03-08 00:00:00,"This International Women's Day, read how @MichelleObama, @MelindaGates and Amal Clooney are working together to help end child marriage. I'm proud of the work @GirlsAlliance is doing to take on issues like this to create a better world for girls everywhere.https://t.co/m49a4abtjk"
obama_1_25,2023-03-05 00:00:00,Judy Heumann dedicated her life to the fight for civil rights
obama_1_26,2023-03-02 00:00:00,"“Fired up. Ready to go!” Edith Childs understands the power of a single voice, and she used those words to light up a room during my campaign stop in Greenwood, SC back in 2007.

I recently caught up with Edith, who just retired after 24 years in public service. Take a look: https://t.co/IhW6pqnAQR"
obama_1_27,2024-01-01 00:00:00,"Real change happens one person, one community, one connection at a time. If you’re an emerging leader in Chicago, Detroit, or Jackson"
obama_1_28,2024-01-01 00:00:00,"I’m so proud of the work we’ve done at @MBK_Alliance, and the young men who’ve been a part of this community. And we're not done yet. We’ll keep working to make sure even more boys and young men reach their full potential."
obama_1_29,2024-01-01 00:00:00,"I’m excited to announce that 105 inspiring young people from across Africa, Asia-Pacific, and Europe will be joining the @ObamaFoundation Leaders program. 

I am so proud of all of you, and I can't wait to see what you do. https://t.co/ifQMoumj2Q"
obama_2_30,2024-01-01 00:00:00,"Dr. Blank's four years serving in my administration was just one part of her extraordinary life. Whether in government or academia, she devoted her career to reducing inequality and increasing opportunities for others, and made everyone around her better. 
https://t.co/wMGjRAacfN"
obama_2_31,2024-01-01 00:00:00,"Happy Valentine’s Day to the one and only, @MichelleObama. You make every day feel like an adventure. https://t.co/NfywjrrDxb"
obama_2_32,2024-01-01 00:00:00,"Congratulations to the Kansas City @Chiefs, Patrick Mahomes, Travis Kelce and Andy Reid for a great Super Bowl win and for sustained excellence. And shout out to the @Eagles and Jalen Hurts"
obama_2_33,2024-01-01 00:00:00,"@KingJames has been changing the game for 20 years, and has become a leader on and off the court. Congrats on making history."
obama_2_34,2024-01-01 00:00:00,"The scale of devastation after the earthquakes in Türkiye and Syria is almost unimaginable. Michelle and I are thinking of the thousands of people who have been affected, including Syrian refugees. Here are some resources for anyone looking to help."
obama_2_35,2024-01-01 00:00:00,"At my last Black History Month celebration at the White House, we had folks of all ages come together to celebrate"
obama_2_36,2024-01-01 00:00:00,"Black History Month is about the shared experience of all Black Americans whose lives have shaped, challenged, and ultimately strengthened America."
obama_2_37,2024-01-01 00:00:00,"Along with mourning Tyre and supporting his family, it’s up to all of us to mobilize for lasting change. To learn more about how communities can reimagine public safety to prevent both crime and injustice, go to https://t.co/I39Nsel4vs."
obama_2_38,2024-01-01 00:00:00,"The vicious, unjustified beating of Tyre Nichols and his ultimate death at the hands of five Memphis police officers is just the latest, painful reminder of how far America still has to go in fixing how we police our streets. https://t.co/ITmrNNJhiT"
obama_2_39,2024-01-01 00:00:00,"I asked Jeff Zients to handle some of our toughest challenges and, without fail, his leadership proved invaluable. He led my economic team as we pushed our most progressive economic policies, and I know he’ll serve @POTUS and the American people well in this new role."
obama_2_40,2024-01-01 00:00:00,"Being @WHCOS is never easy, but Ron Klain has done an outstanding job. From distributing millions of vaccines to passing a bipartisan infrastructure bill, Ron has helped @POTUS keep his promises."
obama_2_41,2024-01-01 00:00:00,"RT @POTUS: Today we learned that more folks than ever before signed up for health insurance through the Affordable Care Act.

From Nov. 1 t…"
obama_2_42,2024-01-01 00:00:00,"We believe that if young people who are passionate about public service get financial aid for college, exposure to travel, and the networks they need to make a difference, the sky's the limit.

I hope you'll apply by March 22. https://t.co/IGJNIOwmkI"
obama_2_43,2024-01-01 00:00:00,".@Bchesky and I were excited to meet with the inaugural class of Voyager Scholarship recipients at our Summit last year.

And we're proud to announce that applications for the second class of Voyagers are now open: https://t.co/rbtrjAlgPe https://t.co/XCmwGPIBP4"
obama_2_44,2024-01-01 00:00:00,I hope you’ll join with the activists who’ve been sounding the alarm on this issue for years
obama_2_45,2024-01-01 00:00:00,"On what would have been the 50th anniversary of Roe v. Wade, we’re reminded that progress can move backward. And that means we’ve got to recommit to doing our part to protect and expand reproductive rights for families today"
obama_2_46,2024-01-01 00:00:00,"Prime Minister @JacindaArdern has guided New Zealand through crises and seized opportunities by leading with foresight, integrity and empathy. Her country is better off because of her remarkable leadership"
obama_2_47,2024-01-01 00:00:00,Proud to see @SecBlinken visiting my hometown of Chicago! The Ukrainian community has always been a big part of what makes our city special
obama_2_48,2024-01-01 00:00:00,All this while solidifying our alliances and offering a guiding hand during a time of increasing global conflict and upheaval. I’m grateful for all that President Biden and Vice President Harris have done for the American people. And I know they’re just getting started.
obama_2_49,2024-01-01 00:00:00,"And for the first time in nearly 30 years, Congress was able to pass significant gun safety legislation to help save lives."
obama_2_50,2024-01-01 00:00:00,"Under the leadership of the Biden-Harris administration, our economy has added more than 10.7 million jobs. President Biden also worked across the aisle to rebuild our infrastructure and invest in American manufacturing."
obama_2_51,2024-01-01 00:00:00,They’ve strengthened the Affordable Care Act. They’ve lowered health care costs for seniors. They’ve capped the costs of insulin. They’ve distributed hundreds of millions of free vaccines.
obama_2_52,2024-01-01 00:00:00,Today marks two years since the Biden-Harris administration began. I’ve been reflecting on how fortunate we’ve been to have the steady leadership of @POTUS and @VP
obama_2_53,2024-01-01 00:00:00,"Applications are now open for our new @ObamaFoundation Leaders USA program.

We're looking for passionate emerging leaders from every corner of the country, ages 24 to 45, who are making an impact in their community.

I hope you'll apply by February 3 at https://t.co/xH55hkIkMI. https://t.co/4RuS240Wd4"
obama_2_54,2024-01-01 00:00:00,"Happy birthday, @MichelleObama. You make every day brighter"
obama_2_55,2024-01-01 00:00:00,"Today we pay tribute to the extraordinary life and legacy of Dr. King, and reflect on the lessons he taught us. Thanks to everyone who joined the @ObamaFoundation to lend a hand in Chicago. https://t.co/06Xb4aRFAJ"
obama_2_56,2024-01-01 00:00:00,"If you need to get covered, head over to https://t.co/DEjP7PTKgn. Open enrollment ends this Sunday, January 15."
obama_2_57,2024-01-01 00:00:00,I’ll always be proud to have my name associated with a program that’s helping folks get the health care they need.  https://t.co/mnOTx4jdOA
obama_2_58,2024-01-01 00:00:00,"This week, Illinois joined states across the country in passing a historic gun violence prevention package. This would not have been possible without the work of grassroots organizers, survivors and their families, and lawmakers who channeled their anguish into bold action."
obama_2_59,2024-01-01 00:00:00,"RT @welcomeus: Through new humanitarian sponsorship programs, vulnerable newcomers can now find safety in the U.S. with the support of a sp…"
obama_3_60,2024-01-01 00:00:00,RT @POTUS: Nearly 16 million people have signed up for coverage through the Affordable Care Act since the start of open enrollment. That’s…
obama_3_61,2024-01-01 00:00:00,"If you haven't already, I hope you’ll take some time to watch Descendant on @Netflix. It's an important documentary that shares the story of the descendants of the Clotilda, the last known ship carrying enslaved folks from Africa, as they uncover the truth about the past. https://t.co/GQGDoGvwKQ"
obama_3_62,2024-01-01 00:00:00,"Last fall, visual artist Adam Davis captured tintype photos of the descendants of Africatown during the premiere of the @HGMedia documentary Descendant. He recently took one of me, too. These photos were inspired by the images taken of a Clotilda survivor, Cudjoe Lewis. https://t.co/ocXP8K8AkZ"
obama_3_63,2024-01-01 00:00:00,RT @MichelleObama: I was lucky to grow up surrounded by relatives
obama_3_64,2024-01-01 00:00:00,"The entire world has a stake in the success of Brazil’s democracy. Together, we must reject any effort to overturn or disrupt the will of the Brazilian people and affirm the peaceful transfer of power as a cornerstone of democracy."
obama_3_65,2024-01-01 00:00:00,"15 years ago today, our campaign won the Iowa caucuses. I’ll always be grateful to the people who organized across the state, and built the relationships that made it all possible.

I recently sat down with six organizers to talk about that time and what they’ve been up to since. https://t.co/2fghTvMdLn"
obama_3_66,2024-01-01 00:00:00,"Happy New Year! 

In 2022, people around the world helped change their communities for the better. Let's keep it up in 2023. We’ve still got a lot of work to do, but I’ll be right there with you. 

Here's to a happy, healthy, and peaceful new year."
obama_3_67,2024-01-01 00:00:00,"The work the @ObamaFoundation did in 2022 makes me hopeful for the future.

From supporting the next generation of leaders to strengthening democracy around the world, we've made a lot of progress this year.

Take a look: https://t.co/gH86QX68cP"
obama_3_68,2024-01-01 00:00:00,"Pelé was one of the greatest to ever play the beautiful game. And as one of the most recognizable athletes in the world, he understood the power of sports to bring people together. Our thoughts are with his family and everyone who loved and admired him. https://t.co/urGRDePaPv"
obama_3_69,2024-01-01 00:00:00,"Michelle and I send our best wishes to families celebrating Kwanzaa this holiday season. Today begins a week-long celebration of African-American heritage and culture. As folks gather to light the Kinara, we hope you have a happy Kwanzaa. https://t.co/zgsyugVPYE"
obama_3_70,2024-01-01 00:00:00,"Michelle and I send our best wishes to families celebrating Kwanzaa this holiday season. Today begins a week-long celebration of African-American heritage and culture. As folks gather to light the Kinara, we hope you have a happy Kwanzaa. https://t.co/U57LAGteFJ"
obama_3_71,2024-01-01 00:00:00,"Michelle and I send our best wishes to families celebrating Kwanzaa this holiday season. Today begins a week-long celebration of African-American heritage and culture. As folks gather to light the Kinara, we hope you have a happy Kwanzaa. https://t.co/pMRpcdjVhx"
obama_3_72,2024-01-01 00:00:00,"Merry Christmas, everybody! One of the best parts of the holiday season is getting to spend time with the special people in our lives. I hope you all have a wonderful and joyful Christmas. https://t.co/RiEJRg0HkI"
obama_3_73,2024-01-01 00:00:00,I always enjoy sharing my end of year music playlist with all of you
obama_3_74,2024-01-01 00:00:00,I saw some great movies this year – here are some of my favorites. What did I miss? https://t.co/vsgEmc8cn8
obama_3_75,2024-01-01 00:00:00,"I always look forward to sharing my lists of favorite books, movies, and music with all of you.
 
First up, here are some of the books I read and enjoyed this year. Let me know which books I should check out in 2023. https://t.co/NuGA7dDz9G"
obama_3_76,2024-01-01 00:00:00,"I grew up watching Franco Harris, and had the honor of getting to know him years later. He was an extraordinary man on and off the field, and will be missed. Our thoughts go out to his family and all of Steeler Nation."
obama_3_77,2024-01-01 00:00:00,"Congrats to Argentina and to the GOAT, Lionel Messi, for an amazing World Cup victory."
obama_3_78,2024-01-01 00:00:00,"Michelle and I send our warmest wishes to everyone celebrating Hanukkah. At a time when antisemitism is on the rise around the world, let’s remember that the light of hope will always shine brighter than hate. From my family to yours, Chag Sameach!"
obama_3_79,2024-01-01 00:00:00,"But in the 10 years since, the families of Sandy Hook have taken unimaginable sorrow and channeled it into a righteous cause"
obama_3_80,2024-01-01 00:00:00,"I consider December 14th, 2012 the single darkest day of my presidency. The news from Sandy Hook Elementary was devastating, a visceral blow, and like so many others, I felt not just sorrow but anger at a world that could allow such things to happen. https://t.co/Y2log7FBaH"
obama_3_81,2024-01-01 00:00:00,"It’s a landmark moment in the fight for equality, and a tribute to the generations of Americans whose example and advocacy have done more than any law to change hearts and minds.

This is their victory, and a powerful reminder that, together, we can continue to perfect our union."
obama_3_82,2024-01-01 00:00:00,"By mandating the federal recognition of same-sex marriages, the Respect for Marriage Act brings us closer to preserving the fundamental right of every American to marry who they love."
obama_3_83,2024-01-01 00:00:00,"In 2015, when the Supreme Court recognized the Constitutional right to marriage equality, I said that progress often comes in small increments. Then there are days when slow, steady effort is rewarded with justice that arrives like a thunderbolt.

Today is one of those days."
obama_3_84,2024-01-01 00:00:00,Grateful for the long-overdue release of Brittney Griner today from Russian custody. Kudos to @POTUS and his administration for the difficult diplomatic work involved to make it happen. We’re looking forward to having Brittney back home.
obama_3_85,2024-01-01 00:00:00,"RT @ObamaFoundation: Last night, President @BarackObama joined @SandyHook families to honor the 20 precious children and 6 brave adults who…"
obama_3_86,2024-01-01 00:00:00,"Once again, Georgians have proven that when it comes time to vote, they’ll show up and vote for a leader who will fight for them. Congratulations, @ReverendWarnock!"
obama_3_87,2024-01-01 00:00:00,"Vote for @ReverendWarnock. 

Vote today to build on the work of people like John Lewis and Ann Nixon Cooper who paved the way for us. 

Vote to build a better future for the next generation. https://t.co/SRPhjFLzGA https://t.co/N0wLBhQ8XO"
obama_3_88,2024-01-01 00:00:00,"Georgia, it’s time to get out and vote to re-elect @ReverendWarnock. 

Make sure to get your family, friends, and neighbors out to vote, too. 

Find your polling location at https://t.co/SRPhjFuwEA. https://t.co/oDMv7pv6Gc"
obama_4_89,2024-01-01 00:00:00,"Affordable health care is a right, not a privilege. If you haven't already, make sure to sign up for health care during this open enrollment period. Go to https://t.co/ob1YnnWQZD today to pick a plan that works best for you and your family."
obama_4_90,2024-01-01 00:00:00,"That’s why I'm asking every Georgian to get out and vote for Reverend Warnock. Then get everybody you know to vote. 

We can't get tired now. 

Make a plan to vote today at https://t.co/SRPhjFLzGA."
obama_4_91,2024-01-01 00:00:00,".@ReverendWarnock is a hard-working, God-fearing, community-serving leader who tells the truth, sticks to his word, and treats everybody with decency and respect. He’ll keep making Georgia proud in the Senate. https://t.co/7doIwmfBAj"
obama_4_92,2024-01-01 00:00:00,I’m back in Georgia to deliver a simple message: Vote to re-elect @ReverendWarnock. Tune in: https://t.co/iX3Twsy1nr
obama_4_93,2024-01-01 00:00:00,"If you're not from Georgia, you can still get involved in this election by making calls, chipping in if you can, and reaching out to your family and friends in Georgia and reminding them to vote. 

Let’s all do our part to re-elect @ReverendWarnock. https://t.co/tagoZB7g1N"
obama_4_94,2024-01-01 00:00:00,"Georgia! Let’s do this one more time. We need everybody to show up and vote to send @ReverendWarnock back to the Senate.

Go to https://t.co/SRPhjFuwEA to find your polling place and make a plan to vote early."
obama_4_95,2024-01-01 00:00:00,"Michelle and I started the @ObamaFoundation to support the next generation of leaders who are picking up the baton and creating sustainable change in their communities.

On Giving Tuesday, I'm asking you to help keep their work going: https://t.co/RVnftZPxUn https://t.co/fvwjf5GsAI"
obama_4_96,2024-01-01 00:00:00,"Last month, I spoke with some of the incredible small business leaders working on the South and West sides of Chicago. 

As we build the Obama Presidential Center, we’ll work closely with these businesses and hope the Center helps boost economic growth across the city. https://t.co/QIl5oS7Zut"
obama_4_97,2024-01-01 00:00:00,"One of my favorite White House traditions was telling Thanksgiving jokes – which at least I thought were funny. 

Here’s a look back at some of my favorites: https://t.co/t2azgScNau"
obama_4_98,2024-01-01 00:00:00,"Wishing everyone a happy Thanksgiving! As we celebrate, let's give thanks for all the blessings in our lives and give back when we can. We’re also thinking of the brave men and women serving our country far from their home."
obama_4_99,2024-01-01 00:00:00,But voters in some states
obama_4_100,2024-01-01 00:00:00,"Thanks in part to the NDRC, states that were once gerrymandered by Republicans"
obama_4_101,2024-01-01 00:00:00,"One reason the balance of power in the House of Representatives is so close is because, for the first time in a decade, there were enough competitive districts at play. Thanks to the work of @DemRedistrict, Americans voted on the fairest congressional map of the last 40 years."
obama_4_102,2024-01-01 00:00:00,We can and must do more to reduce gun violence in America. https://t.co/cfI3RIMLd2
obama_4_103,2024-01-01 00:00:00,I’m inspired by the next generation of leaders
obama_4_104,2024-01-01 00:00:00,"RT @ObamaFoundation: On the eve of Trans Day of Remembrance, the LGBTQ+ community in Colorado Springs was terrorized by gun violence. We jo…"
obama_4_105,2024-01-01 00:00:00,"Best of luck to @USMNT at the World Cup! Michelle and I are incredibly proud of what you’ve accomplished so far, and we’ll be rooting for you all the way."
obama_4_106,2024-01-01 00:00:00,"Happy birthday, @JoeBiden! There’s a lot to celebrate these days, and I couldn’t be more grateful that America has you sitting behind the desk. https://t.co/JPcCtDo5SI"
obama_4_107,2024-01-01 00:00:00,"Yesterday @BChesky and I had the chance to meet with our inaugural recipients of The Voyager Scholarship.

Michelle, Brian, and I can’t wait to work with these talented young people over the next few years as they pursue careers in public service. https://t.co/K8VE7It3yw"
obama_4_108,2024-01-01 00:00:00,Our @ObamaFoundation Leaders are working hard to tackle some of our toughest challenges. It was great having some of them join @TrevorNoah and me on @TheDailyShow to share more about their work. https://t.co/8SS3eEODVh
obama_4_109,2024-01-01 00:00:00,"I’m happy to announce that we’ll be launching a new and expanded Leaders United States program in the coming months that can help more young people put their idealism to work. 

Michelle and I are proud to support these young leaders through our work at the Obama Foundation. https://t.co/iUGzHiT0Me"
obama_4_110,2024-01-01 00:00:00,"Today at the @ObamaFoundation Democracy Forum, we brought leaders from around the world together to share ideas and discuss ways to strengthen democracy. https://t.co/qHtO7Ui62q"
obama_4_111,2024-01-01 00:00:00,I'm in New York City for the @ObamaFoundation’s #DemocracyForum with leaders from around the world to discuss how we can strengthen our democracy and support the next generation of leaders working on some of our most important challenges. Tune in: https://t.co/5FGI2dg2WD
obama_4_112,2024-01-01 00:00:00,Speaker Nancy Pelosi will go down as one of most accomplished legislators in American history
obama_4_113,2024-01-01 00:00:00,"But the fight to protect DACA recipients remains unfinished. Earlier this year I sat down with a group of Dreamers, whose stories speak to all the ways in which they strengthen our communities. Congress should act now and resolve their status once and for all."
obama_4_114,2024-01-01 00:00:00,"Some good news from Arizona: voters approved a ballot initiative that will make Dreamers eligible for in-state tuition. Credit goes to the organizers who shared their families' stories and assembled a bipartisan coalition of supporters. 

https://t.co/uIclWnwEAO"
obama_4_115,2024-01-01 00:00:00,"Rest in peace, Virginia. We know you’re up there dancing. https://t.co/y31XQ8MdPC"
obama_4_116,2024-01-01 00:00:00,"Among @MichelleObama's many talents is the fact that she is a fantastic writer. In her new book, The Light We Carry, she shares the tools and lessons she’s learned that help her navigate times of uncertainty. It's a book you'll want to go back to over and over again."
