id,date,text
obama_111_3286,2015-06-09 00:00:00,"According to a recent poll, a clear majority of Americans don't want federal #Obamacare subsidies rolled back: http://t.co/4aYVdAzKVh"
obama_111_3287,2015-06-09 00:00:00,LIVE: President Obama is speaking about the benefits of #Obamacare at @TheCHAUSA. http://t.co/uw5wjjNKbZ
obama_111_3288,2015-06-09 00:00:00,Tune in at 11:50 a.m. ET to watch the President discuss how #Obamacare has improved our health care system: http://t.co/UaLtzkNlMV
obama_111_3289,2015-06-08 00:00:00,Celebrate #NationalBestFriendsDay with the person who brings out the best in you. http://t.co/OVa0I0ItC9
obama_111_3290,2015-06-08 00:00:00,"RT @WhiteHouse: ""All the G-7 countries have now put forward our post-2020 targets for reducing carbon emissions"""
obama_111_3291,2015-06-08 00:00:00,Read why former U.S. Trade Representative Ron Kirk thinks it's time for the United States to #LeadOnTrade: http://t.co/TU84un00UH
obama_111_3292,2015-06-08 00:00:00,Stand up for expanding #CollegeOpportunity for hard-working students: http://t.co/pTyByoRWiB http://t.co/6CzJziVTGw
obama_111_3293,2015-06-06 00:00:00,"""I’m going to keep doing everything I can to make our immigration system more just and more fair."""
obama_111_3294,2015-06-06 00:00:00,"In the weekly address, the President discusses #ImmigrantHeritageMonth and fixing our broken immigration system. http://t.co/FCQz6tgz7F"
obama_111_3295,2015-06-06 00:00:00,"""Beau Biden was an original. He was a good man. A man of character. A man who loved deeply and was loved in return."""
obama_111_3296,2015-06-06 00:00:00,"Read a few wise words from Beau Biden, and see the incredible legacy he leaves behind. http://t.co/2o25fkyn76"
obama_111_3297,2015-06-05 00:00:00,"If you think access to higher education is a key to success, stand up for #CollegeOpportunity: http://t.co/ln9TxHN6o9 http://t.co/EoFGRvRTj5"
obama_111_3298,2015-06-05 00:00:00,"With higher hourly wages and 280,000 new jobs, May's jobs report is good news for our economy. http://t.co/3IT8WkRfrZ"
obama_111_3299,2015-06-05 00:00:00,"If all 50 states expanded Medicaid, they would save billions of dollars and thousands of lives. Read more: http://t.co/BLmQTiWqKW"
obama_111_3300,2015-06-05 00:00:00,"The economy added 280,000 jobs in May"
obama_111_3301,2015-06-04 00:00:00,"There's been a lot of progress on LGBT equality, but there's more work to do. Add your name to join the fight: http://t.co/gxSBV0KY8c"
obama_111_3302,2015-06-04 00:00:00,RT @WhiteHouse: FACT: States refusing to expand Medicaid through the ACA are leaving 4.3 million uninsured → http://t.co/yspWD1vvKm http://…
obama_111_3303,2015-06-04 00:00:00,This shouldn't be a partisan issue. It's time to #ActOnClimate. http://t.co/iOsR9roqLd
obama_111_3304,2015-06-03 00:00:00,It's more fun to run with a friend. #NationalRunningDay http://t.co/3ywdYQtL4i
obama_111_3305,2015-06-03 00:00:00,Keep the momentum going in the fight for equality. Add your name now: http://t.co/i3keRtNN1d http://t.co/rIpdOwSozk
obama_111_3306,2015-06-03 00:00:00,Here's one way to spark change: Share what LGBT equality means to you. http://t.co/NBMdHNqUnG
obama_111_3307,2015-06-02 00:00:00,Join the team that's fighting for LGBT equality: http://t.co/p8ssh2vgKS http://t.co/9jpzHSphzC
obama_111_3308,2015-06-02 00:00:00,People across the country are #WearingOrange today to stand up against gun violence. http://t.co/qmFvPuYmFU
obama_111_3309,2015-06-02 00:00:00,When all Americans are treated equally
obama_111_3310,2015-06-02 00:00:00,RT @WhiteHouse: “One of my core principles is that I will never engage in a politics in which I’m trying to divide people”
obama_111_3311,2015-06-01 00:00:00,Your story matters in the fight for LGBT rights
obama_111_3312,2015-06-01 00:00:00,It takes courage to share your story. https://t.co/Q7wWjV9Rxx
obama_112_3313,2015-06-01 00:00:00,Be on the right side of history. Add your name to continue the fight for equality: http://t.co/08I1PRCsAM #LoveIsLove
obama_112_3314,2015-06-01 00:00:00,Happy Pride Month. #LoveIsLove http://t.co/cpbspiyr7e
obama_112_3315,2015-05-31 00:00:00,"""For all that Beau Biden achieved in his life ... nothing claimed a fuller focus of his love and devotion than his family."""
obama_112_3316,2015-05-30 00:00:00,Watch President Obama address key national security measures and reforms in the weekly address: http://t.co/rFunNqIFLV
obama_112_3317,2015-05-29 00:00:00,Add your name to join the team fighting back against climate change denial: http://t.co/JNEXVHyT0q #ActOnClimate http://t.co/Hbu3cZcUgR
obama_112_3318,2015-05-29 00:00:00,"""Let us carry his legacy forward."""
obama_112_3319,2015-05-29 00:00:00,Another reason why health care reform is so important to millions of Americans. http://t.co/9A0mRMXsqL
obama_112_3320,2015-05-29 00:00:00,New clean water provisions will help protect the health of 117 million Americans. Read more: http://t.co/7qXT338jls #CleanWaterRules
obama_112_3321,2015-05-28 00:00:00,RT @WhiteHouse: A sea level rise of just 1 foot could cost America $200 billion. It's time to #ActOnClimate: http://t.co/lU2sqP1U2v http://…
obama_112_3322,2015-05-28 00:00:00,Read this blog from @GinaEPA and Jo-Ellen Darcy on why protecting water sources is so important: http://t.co/gGqsIgvegm #CleanWaterRules
obama_112_3323,2015-05-28 00:00:00,Enforceable labor and environmental protections are just a couple of reasons why America needs to #LeadOnTrade. http://t.co/4THWZFdRHh
obama_112_3324,2015-05-28 00:00:00,Read about the hurricane preparedness briefing the President is receiving in Miami today: http://t.co/NfRkw4p8l7 #ActOnClimate
obama_112_3325,2015-05-28 00:00:00,A huge step forward in making sure our drinking water is clean. #CleanWaterRules http://t.co/yRZIOgss8Z
obama_112_3326,2015-05-27 00:00:00,Read why #CleanWaterRules are essential to prevent pollution and protect our drinking waters: http://t.co/FXNuuAbJ5n
obama_112_3327,2015-05-27 00:00:00,"When 97 percent of climate scientists agree, it's time for the deniers to put politics aside and #ActOnClimate. http://t.co/mbHMhbVJK9"
obama_112_3328,2015-05-27 00:00:00,RT @EPA: BREAKING NEWS: Our Clean Water Rule has been finalized. https://t.co/k58D7iTOXZ Learn more: http://t.co/CLM6JSQq2L. #CleanWaterRul…
obama_112_3329,2015-05-27 00:00:00,These #CleanWaterRules will protect America's drinking water from polluters. http://t.co/P643CfwEBV
obama_112_3330,2015-05-26 00:00:00,Millions of Americans are counting on this. http://t.co/ncc9veKX6Q
obama_112_3331,2015-05-26 00:00:00,"RT @WhiteHouse: Sally Ride would've been 64 today.
Here's how she inspired us to reach for the stars → http://t.co/hTKHwdxQ8w http://t.co/L…"
obama_112_3332,2015-05-26 00:00:00,Cities nationwide are answering the President's call to #LeadOnLeave and #RaiseTheWage: http://t.co/3VDPVvvCGz
obama_112_3333,2015-05-26 00:00:00,"The President is pursuing the most progressive trade agreement in U.S. history. You can help fight for it, too: http://t.co/uZvkgHBQ7J"
obama_112_3334,2015-05-25 00:00:00,"RT @WhiteHouse: At 11:20am ET, watch President Obama speak on #MemorialDay at Arlington National Cemetery → http://t.co/vUssNvn1AA http://t…"
obama_112_3335,2015-05-23 00:00:00,"""Americans gave everything they had"
obama_112_3336,2015-05-23 00:00:00,Today is the last day to get your application in for the @OFA Summer Fellowship program: http://t.co/KqmyRwmWOl
obama_112_3337,2015-05-23 00:00:00,Watch President Obama pay tribute to the United States Armed Forces in the weekly address: http://t.co/NttY012PUi #MemorialDayWeekend
obama_112_3338,2015-05-22 00:00:00,"If the U.S. doesn't #LeadOnTrade, others will. Let's make sure America writes the rules in this global economy: http://t.co/BL15PXZBuC"
obama_112_3339,2015-05-22 00:00:00,America needs to lead the way and #ActOnClimate. http://t.co/w9QG9qPxF4 http://t.co/U3T5negdYn
obama_112_3340,2015-05-22 00:00:00,The deadline to be part of the summer #OFAFellows program is tomorrow
obama_112_3341,2015-05-22 00:00:00,LIVE: The President is speaking to the Adas Israel Congregation in celebration of Jewish American Heritage Month. http://t.co/yHfyWCckLt
obama_112_3342,2015-05-21 00:00:00,Love is winning: http://t.co/KjLt3A8mk3 #LoveIsLove http://t.co/0EdqRMaqXX
obama_113_3343,2015-05-21 00:00:00,Read how the Obama administration is stepping up to protect honeybees and other pollinators: http://t.co/P6rMxeUq1L
obama_113_3344,2015-05-21 00:00:00,"RT @WhiteHouse: A sea level rise of just 1 foot could cost America $200 billion.

It's time to #ActOnClimate: http://t.co/K5YxkHO9qw http:/…"
obama_113_3345,2015-05-21 00:00:00,Check out the President's speech at the United States Coast Guard Academy on why it's so important to #ActOnClimate: http://t.co/4Zxjs2v9ap
obama_113_3346,2015-05-21 00:00:00,This is about making sure there's a level playing field for American workers in the global economy. http://t.co/kMibkh65YB #LeadOnTrade
obama_113_3347,2015-05-20 00:00:00,TV won't be the same without Dave. http://t.co/9q5NHTf3b5
obama_113_3348,2015-05-20 00:00:00,"America needs to #LeadOnTrade. If you want trade policy that's tough, progressive, and transparent, add your name: http://t.co/xv3tZi1G4H"
obama_113_3349,2015-05-20 00:00:00,"RT @WhiteHouse: The planet is getting warmer.
Glaciers are melting.
Sea levels are rising.

It's time to #ActOnClimate. http://t.co/l1rKJK5…"
obama_113_3350,2015-05-20 00:00:00,"""This cannot be subject to the usual politics and the usual rhetoric."""
obama_113_3351,2015-05-20 00:00:00,"""It will not be easy, it will require sacrifices, and the politics will be tough. But there is no other way."""
obama_113_3352,2015-05-20 00:00:00,"""The only way the world is going to prevent the effects of climate change is to slow down the warming of the planet."""
obama_113_3353,2015-05-20 00:00:00,"""Climate change"
obama_113_3354,2015-05-20 00:00:00,"""Denying it or refusing to deal with it endangers our national security."""
obama_113_3355,2015-05-20 00:00:00,"""Cadets, the threat of a changing climate cuts to the very core of your service."""
obama_113_3356,2015-05-20 00:00:00,"""The planet is getting warmer. Fourteen of the 15 hottest years on record have been in the past 15 years."""
obama_113_3357,2015-05-20 00:00:00,"""The best scientists in the world know that climate change is happening."""
obama_113_3358,2015-05-20 00:00:00,LIVE: President Obama is delivering the keynote address at the commencement ceremony of the U.S. Coast Guard Academy. http://t.co/bkb3Wwjzvi
obama_113_3359,2015-05-20 00:00:00,Tune in at 11:35 a.m. ET to watch the President deliver a commencement speech at the U.S. Coast Guard Academy: http://t.co/0CUMi3p5BU
obama_113_3360,2015-05-19 00:00:00,This is why health care reform matters. http://t.co/vc3R43veNk
obama_113_3361,2015-05-19 00:00:00,RT @WhiteHouse: Celebrate 50 years of @HeadStartGov with President Obama and these cute kids from Kansas → http://t.co/5r9Ip9gxWi https://t…
obama_113_3362,2015-05-19 00:00:00,Bees. http://t.co/gzqCOf1l0i
obama_113_3363,2015-05-19 00:00:00,This is your opportunity to get your start in community organizing: http://t.co/XVzPFfiNX0
obama_113_3364,2015-05-18 00:00:00,It's time to do away with Mad Men-era workplace policies
obama_113_3365,2015-05-18 00:00:00,LIVE: President Obama is speaking to youth and local law enforcement in New Jersey. http://t.co/Mp3KIk8WO2
obama_113_3366,2015-05-18 00:00:00,"Welcome @POTUS, the official government account of the President of the United States."
obama_113_3367,2015-05-18 00:00:00,What will it take for climate change deniers to #ActOnClimate? http://t.co/uN7gkOcpyM
obama_113_3368,2015-05-16 00:00:00,"""We want a place where you can make it if you try. That’s the promise we make to our young people."""
obama_113_3369,2015-05-16 00:00:00,"In the weekly address, President Obama discusses the importance of expanding opportunity for all Americans: http://t.co/viCQAQZm4k"
obama_113_3370,2015-05-15 00:00:00,This is about leveling the playing field for American workers in the global economy
obama_113_3371,2015-05-15 00:00:00,RT @WhiteHouse: President Obama applauds the Senate on taking an important step toward a trade deal that benefits American workers. http://…
obama_113_3372,2015-05-15 00:00:00,You could be the next great grassroots organizer. Here's how: http://t.co/7dyYULsFmY #OFAFellows
obama_114_3373,2015-05-15 00:00:00,"""There’s going to be one killer blues session in heaven tonight."""
obama_114_3374,2015-05-14 00:00:00,"""When it comes to a woman's health, no politician should get to decide what's best for you."""
obama_114_3375,2015-05-14 00:00:00,This is a real step forward in creating a fair environment for the roughly 40 million Americans with student debt: http://t.co/8TdhanWMrF
obama_114_3376,2015-05-14 00:00:00,"It's the #GimmeFive challenge, presidential style. http://t.co/5ZLnuQ65ly"
obama_114_3377,2015-05-14 00:00:00,This shouldn't be an issue in 2015. #LeadOnLeave http://t.co/dJFCjxeS1R
obama_114_3378,2015-05-14 00:00:00,Yumi used to think she couldn't make a difference
obama_114_3379,2015-05-13 00:00:00,It's time for the United States to #LeadOnTrade
obama_114_3380,2015-05-13 00:00:00,America needs to #LeadOnTrade by making sure any deal lives up to our values. (graphic via @WhiteHouse) http://t.co/TqJAo0cGeH
obama_114_3381,2015-05-13 00:00:00,"""Our thoughts and prayers go out to the families and friends of those we lost last night."""
obama_114_3382,2015-05-12 00:00:00,Add your name if you think it's time to treat paid leave like the economic priority it is: http://t.co/C6uxNauhYK #LeadOnLeave
obama_114_3383,2015-05-12 00:00:00,It's time to do better by working families. Let's #LeadOnLeave. http://t.co/fp5rw6y6of
obama_114_3384,2015-05-12 00:00:00,RT @WhiteHouse: RT if you agree: It’s time to expand opportunity by investing in early childhood education. #PovertySummit http://t.co/jGFM…
obama_114_3385,2015-05-12 00:00:00,Sign on if you agree that working families deserve paid leave: http://t.co/3FaJzk6cI8 #LeadOnLeave
obama_114_3386,2015-05-11 00:00:00,NASA leads the world in the exploration and study of planets. Let's not let climate change deniers change that: http://t.co/dcUlvdFaha
obama_114_3387,2015-05-11 00:00:00,RT @WhiteHouse: Watch President Obama surprise moms across the country to wish them a #HappyMothersDay: https://t.co/PVRIZ389Oh
obama_114_3388,2015-05-11 00:00:00,"As we continue to celebrate mothers, let's make sure workplace policies live up to what they deserve: http://t.co/hloGsujQfS #LeadOnLeave"
obama_114_3389,2015-05-11 00:00:00,It's time to give American workers the security of paid leave. #LeadOnLeave http://t.co/u0vythSZ0g
obama_114_3390,2015-05-09 00:00:00,"""We will be forever grateful for what these remarkable men and women did."""
obama_114_3391,2015-05-09 00:00:00,WATCH: President Obama honors the 70th anniversary of VE Day in the weekly address: http://t.co/vMm2UxSIFt
obama_114_3392,2015-05-08 00:00:00,President Obama visits his 50th state today. See White House photographer @PeteSouza's gallery from the first 49: http://t.co/mQwCsZEcqM
obama_114_3393,2015-05-08 00:00:00,"In the last 62 months, over 12.3 million private-sector jobs have been added to the economy. Read more: http://t.co/f0QrgOt1iB"
obama_114_3394,2015-05-08 00:00:00,"""When the playing field is level, nobody beats the United States of America."""
obama_114_3395,2015-05-08 00:00:00,"""If any agreement undercuts working families"
obama_114_3396,2015-05-08 00:00:00,"""If you are opposed to these smart, progress trade deals, that means you must be satisfied with the status quo."""
obama_114_3397,2015-05-08 00:00:00,"""We have to make sure America writes the rules of the global economy."""
obama_114_3398,2015-05-08 00:00:00,"""If we don't write the rules for trade around the world, guess what: China will."""
obama_114_3399,2015-05-08 00:00:00,"""I view smart trade agreements as a part of middle-class economics."""
obama_114_3400,2015-05-08 00:00:00,"LIVE: President Obama is speaking about trade in Beaverton, Oregon. http://t.co/m7g1VbsPrj"
obama_114_3401,2015-05-08 00:00:00,"Tune in at 12:15 p.m. ET to watch the President deliver remarks on trade in Beaverton, Oregon: http://t.co/m7g1VbsPrj"
obama_114_3402,2015-05-08 00:00:00,"The economy added 223,000 jobs in April"
obama_115_3403,2015-05-07 00:00:00,Too many elected officials are still in denial about climate change. Join the team holding them accountable: http://t.co/UEGDqi8UQd
obama_115_3404,2015-05-07 00:00:00,"Carbon pollution in the atmosphere has hit a dangerous milestone. It's time for action, not denial. http://t.co/PbTnZNaFTi #ActOnClimate"
obama_115_3405,2015-05-07 00:00:00,That time President Obama didn't need an anger translator to show how much we need to #ActOnClimate: http://t.co/gI2YPGJ15B #TBT
obama_115_3406,2015-05-06 00:00:00,Addressing climate change isn't just good for our planet and our economy
obama_115_3407,2015-05-06 00:00:00,"RT @VP: Community
College
Should
Be
Free.
#collegein5words 
https://t.co/EQrXb7ILnZ http://t.co/Sy5Yo7QNAD"
obama_115_3408,2015-05-05 00:00:00,Add your name if you're ready to #ActOnClimate: http://t.co/Ivsom2VXOg http://t.co/T7CeyDxzkk
obama_115_3409,2015-05-05 00:00:00,David Letterman and President Obama discussed retirement plans last night. Take a look: http://t.co/ZfMIDfd92e
obama_115_3410,2015-05-05 00:00:00,This @OFA volunteer is fighting to make the world better for her grandchildren. http://t.co/S2Bgd6Tq7L
obama_115_3411,2015-05-04 00:00:00,Working families deserve paid leave. #LeadOnLeave http://t.co/5tlrfY7ZfQ
obama_115_3412,2015-05-04 00:00:00,Happening now: President Obama delivers remarks for the launch of the My Brother's Keeper Alliance at @LehmanCollege. http://t.co/Rh8KgadI7g
obama_115_3413,2015-05-04 00:00:00,Tune in at 2:35 p.m. ET to watch the President speak at the launch of the My Brother's Keeper Alliance. http://t.co/UDmQPkCfss
obama_115_3414,2015-05-04 00:00:00,The science is clear
obama_115_3415,2015-05-02 00:00:00,"""A great education can be within everyone’s reach."""
obama_115_3416,2015-05-02 00:00:00,"WATCH: In the weekly address, President Obama reiterates his commitment to expanding access to education. http://t.co/mysKXSAUix"
obama_115_3417,2015-05-01 00:00:00,Teachers have the ability to influence their students for life. #ThankATeacher and share how important yours were: http://t.co/KgJczHwPMP
obama_115_3418,2015-05-01 00:00:00,"RT @FLOTUS: Who's ready for #CollegeSigningDay?
Share a photo in your college gear to celebrate students pushing to #ReachHigher. http://t.…"
obama_115_3419,2015-05-01 00:00:00,Know someone who would be perfect for this fellowship? Here's where to apply: http://t.co/ahGWYDvUSD
obama_115_3420,2015-04-30 00:00:00,"RT @WhiteHouse: ""I want boys and girls studying all the subjects and getting good at all the subjects"""
obama_115_3421,2015-04-30 00:00:00,President Obama runs into a group of schoolchildren while walking near the White House. WARNING: cuteness ensues. http://t.co/rmFzZICnlX
obama_115_3422,2015-04-30 00:00:00,Read President Obama's op-ed in the @MiamiHerald on why we can't wait to #ActOnClimate: http://t.co/XZf9ASsVVU
obama_115_3423,2015-04-30 00:00:00,LIVE: The President takes a virtual field trip and discusses improving access to libraries for students. http://t.co/2nvtVWNJdc #BooksForAll
obama_115_3424,2015-04-29 00:00:00,Read how this fifth-grade teacher helped inspire the President of the United States: http://t.co/mEGP8AXs16 #ThankATeacher
obama_115_3425,2015-04-29 00:00:00,"Our education shapes who we become. Share who inspired you, and #ThankATeacher today: http://t.co/gwZNbvbEZ1"
obama_115_3426,2015-04-29 00:00:00,Check out President Obama's interview with @WSJ on why America needs to #LeadOnTrade: http://t.co/XEu9c6vNIg
obama_115_3427,2015-04-29 00:00:00,"RT @WhiteHouse: Great to see @JNJNews expand paid leave benefits.
Now it's time for Congress to #LeadOnLeave: https://t.co/Pl8iwTrYMd http:…"
obama_115_3428,2015-04-29 00:00:00,.@OFA's fellowship program is all about training the next generation of grassroots organizers. Be a part of it: http://t.co/TN53ePaXgJ
obama_115_3429,2015-04-29 00:00:00,LIVE: President Obama honors the 2015 National Teacher of the Year. http://t.co/yXt8U62ov0 #ThankATeacher
obama_115_3430,2015-04-28 00:00:00,RT @WhiteHouse: Watch President Obama speak on the situation in Baltimore. http://t.co/T3t6ptxmaZ
obama_115_3431,2015-04-27 00:00:00,"If you aspire to be a better community organizer, this is for you: http://t.co/Nrmi9c8SLo"
obama_115_3432,2015-04-27 00:00:00,"Thanks to health care reform, people have more options"
obama_116_3433,2015-04-27 00:00:00,"Congratulations to Loretta Lynch, who was sworn in as U.S. attorney general today, the first African-American woman to hold the post."
obama_116_3434,2015-04-27 00:00:00,ICYMI: Watch President Obama's full remarks to @OFA supporters last week. http://t.co/CoWHv3BKPO
obama_116_3435,2015-04-26 00:00:00,LIVE: Watch the 2015 White House Correspondents' Dinner. http://t.co/JYRHmvEGSV #WHCD
obama_116_3436,2015-04-25 00:00:00,Cecily Strong hosts the White House Correspondents' Dinner tonight at 8 p.m. ET. Watch it here: http://t.co/9tfUryyAP7
obama_116_3437,2015-04-25 00:00:00,"""We can’t surrender to the future"
obama_116_3438,2015-04-25 00:00:00,"In the weekly address, the President discusses how the new trade deal will benefit American workers and businesses: http://t.co/NjuKWBEk62"
obama_116_3439,2015-04-24 00:00:00,Farmers can fight climate change. Read about the Obama administration's new plans to help: http://t.co/MWU7oqD8Cn #ActOnClimate
obama_116_3440,2015-04-24 00:00:00,"If you know someone looking to take their organizing skills to the next level, send them here: http://t.co/FRpGyX7iVh"
obama_116_3441,2015-04-24 00:00:00,America can't stand by and let other countries #LeadOnTrade. We have to step up and write free and fair trade rules. http://t.co/epz8uJekra
obama_116_3442,2015-04-23 00:00:00,"""You give me hope. You guys are doing extraordinary things."""
obama_116_3443,2015-04-23 00:00:00,"""Talk to your friends, talk to your neighbors, talk about why this work matters."""
obama_116_3444,2015-04-23 00:00:00,"""If I didn't think this was the best thing to do for working families, I would not be doing it."""
obama_116_3445,2015-04-23 00:00:00,"""We've got to fight for trade that benefits our workers"
obama_116_3446,2015-04-23 00:00:00,"""I've been fighting income inequality since before it was cool."""
obama_116_3447,2015-04-23 00:00:00,"""My entire presidency has been about helping working families."""
obama_116_3448,2015-04-23 00:00:00,"""The status quo isn't working for our workers."""
obama_116_3449,2015-04-23 00:00:00,"""It's not just good for our businesses, it's good for our workers."""
obama_116_3450,2015-04-23 00:00:00,"""It's the most progressive trade agreement in our history."""
obama_116_3451,2015-04-23 00:00:00,"""We want to make sure we win the future. That's what America is about."""
obama_116_3452,2015-04-23 00:00:00,"""America needs to write the rules of the global economy. We can't leave it to somebody else."""
obama_116_3453,2015-04-23 00:00:00,"""This set of trade agreements that we're looking at is vital to middle-class economics."""
obama_116_3454,2015-04-23 00:00:00,"""Today, more than 16 million Americans have gained the security of health insurance."""
obama_116_3455,2015-04-23 00:00:00,"""I'm proud of all of you, and I hope all of you are proud of what we've done together."""
obama_116_3456,2015-04-23 00:00:00,"""You guys sound fired up!"""
obama_116_3457,2015-04-23 00:00:00,LIVE on @OFA #Periscope: President Obama is speaking at the 2015 Spring Summit. http://t.co/j3cxgyiH9q
obama_116_3458,2015-04-23 00:00:00,You won't want to miss this. http://t.co/FPV0VEwFAz
obama_116_3459,2015-04-23 00:00:00,Here’s a reminder from @GinaEPA of a few challenges the EPA has conquered in the past: http://t.co/voNhiOhjX6 #ActOnClimate
obama_116_3460,2015-04-23 00:00:00,Apply to be an @OFA fellow today to make a difference in your community: http://t.co/CouTSgfZJR
obama_116_3461,2015-04-23 00:00:00,RT @WhiteHouse: President Obama will deliver a statement from the White House Briefing Room at 10am ET. Watch here → http://t.co/gOsq0AWf0I
obama_116_3462,2015-04-22 00:00:00,#ClimateChangeIsReal. So is President Obama's 3-point game. http://t.co/M27bxCqJSG
obama_117_3463,2015-04-22 00:00:00,RT @NatlParkService: President Obama & @BillNye meeting w/ 4th graders from Miami to talk about #ClimateChange in honor of #EarthDay! http:…
obama_117_3464,2015-04-22 00:00:00,"""We are blessed with the most beautiful God-given landscape in the entire world ... We have to be good stewards for it."""
obama_117_3465,2015-04-22 00:00:00,"""This is not some impossible problem that we cannot solve. We can solve it if we have the political will."""
obama_117_3466,2015-04-22 00:00:00,"""No matter who you are, no matter where you live, our parks ... are your birthright as Americans."""
obama_117_3467,2015-04-22 00:00:00,"""Every dollar invested in the National Park Service generates $10 for the American economy. That's a good investment."""
obama_117_3468,2015-04-22 00:00:00,"""Climate change can no longer be denied. It can't be edited out. It can't be omitted from the conversation."""
obama_117_3469,2015-04-22 00:00:00,"""The Pentagon says that climate change poses an increasing set of risks for global security."""
obama_117_3470,2015-04-22 00:00:00,"""If we don't act, there may not be an Everglades as we know it."""
obama_117_3471,2015-04-22 00:00:00,"""I can't think of a better way to spend Earth Day than in one of our greatest national treasures, the Everglades."""
obama_117_3472,2015-04-22 00:00:00,LIVE: President Obama is discussing the threat climate change poses to our economy and to the world. http://t.co/nDOE0KVHhz #ActOnClimate
