id,date,text
obama_26_774,2024-01-01 00:00:00,"If you're in Georgia, make sure you and everybody you know is registered to vote by Monday, December 7. And if you turn 18 by January 5, you're eligible to vote in the runoff. Get registered right now: https://t.co/cb19SHEChF"
obama_26_775,2024-01-01 00:00:00,"Join me for a conversation with the next U.S. Senators from Georgia, @ReverendWarnock and @Ossoff, along with @StaceyAbrams and @NikemaWilliams. The stakes couldn’t be higher for their runoffs: https://t.co/4fHxACdIge https://t.co/ahVWcgKgw5"
obama_26_776,2024-01-01 00:00:00,"We started the @ObamaFoundation to help a new generation build a better tomorrow. And many of them already are, stepping up through the pandemic and protests to demand real change.

On Giving Tuesday, I'm asking you to invest in them: https://t.co/EmEqSufrBP https://t.co/DqXKqypaU7"
obama_27_777,2024-01-01 00:00:00,"Let’s all do our part this Thanksgiving to keep people safe and healthy. Celebrate virtually, if you can. Wear a mask. And as always, listen to the experts. The choices you make could save lives."
obama_27_778,2024-01-01 00:00:00,The balance of power in the Senate is at stake in Georgia’s runoff election. We’ve got two great candidates
obama_27_779,2024-01-01 00:00:00,Michelle and I are eager to bring the Obama Presidential Center to our hometown
obama_27_780,2024-01-01 00:00:00,RT @ObamaFoundation: Watch Now: @BarackObama joins @MBK_Alliance youth and community leaders and @CapehartJ for a conversation about leader…
obama_27_781,2024-01-01 00:00:00,"This was fun. I heard Tim and Fred were listening to some of the songs on my A Promised Land playlist, so I decided to drop in and surprise them. We talked about a lot, from Bob Dylan to old-school mixtapes to the role music played in my memoir. https://t.co/8A0cuVNHZI https://t.co/rQwW8r0wBX"
obama_27_782,2024-01-01 00:00:00,"My memoir, A Promised Land, is out today. I hope you’ll read it. My goal was to give you some insight into the events and people that shaped me during the early years of my presidency. Most of all, I hope it inspires you to see yourself playing a role in shaping a better world. https://t.co/hdZysCpCN9"
obama_27_783,2024-01-01 00:00:00,Music has always played an important role in my life
obama_27_784,2024-01-01 00:00:00,"More than anyone else, I wrote my book for young people"
obama_27_785,2024-01-01 00:00:00,"Today, we’re reminded of our solemn obligation: to serve our veterans as well as they have served us. To all of our veterans and service members, we’re forever grateful for your commitment to our country"
obama_27_786,2024-01-01 00:00:00,"Congratulations to my friends, @JoeBiden and @KamalaHarris"
obama_27_787,2024-01-01 00:00:00,"Thank you Chiney, Nneka, and all of the athletes who are using their platforms and helping people vote in this elec… https://t.co/f7QvXIqVK9"
obama_27_788,2024-01-01 00:00:00,"Rahul, you're helping make democracy work today. Thank you. https://t.co/wOtcgc8zHh"
obama_27_789,2024-01-01 00:00:00,"There's a reason some folks are trying to make it hard for you to vote: They know that if you do, things change. An… https://t.co/QGVIp9OO4F"
obama_27_790,2024-01-01 00:00:00,"If you are in line to vote before polls close, you have the right to vote. Stay in line for as long as it takes. If… https://t.co/0Q2PD3DvKq"
obama_27_791,2024-01-01 00:00:00,"This Election Day, everything is on the line. Our jobs. Our health care. Whether or not we get this pandemic under… https://t.co/Ea1SeuRNGW"
obama_27_792,2024-01-01 00:00:00,"RT @JoeBiden: Voting is your right. If you have questions, reach out to the Voter Assistance Hotline at 1-833-336-8683. https://t.co/CkLIJG…"
obama_27_793,2024-01-01 00:00:00,"This is it –– today is the last day to vote. If you haven't already, find your polling place at… https://t.co/7SoEYS9RgB"
obama_27_794,2024-01-01 00:00:00,"For eight years, Joe was the last one in the room whenever I faced a big decision. He made me a better president. A… https://t.co/vG8hWIElk2"
obama_27_795,2024-01-01 00:00:00,"More than 100 million Americans have already cast a ballot in this election. Joel, Monica, and Andrés are three of… https://t.co/Gnw67kkOgC"
obama_27_796,2024-01-01 00:00:00,Our administration literally left this White House a playbook that would have shown them how to respond before COVI… https://t.co/8mzB2v8yFb
obama_27_797,2024-01-01 00:00:00,"On Tuesday, you can choose change. You can choose a better America. You can elect @JoeBiden and @KamalaHarris. I am… https://t.co/h5dAn3W9GC"
obama_27_798,2024-01-01 00:00:00,"Maaza, this is beautiful. Thank you for voting"
obama_27_799,2024-01-01 00:00:00,"Congrats on your first vote, Dewey! It will make a difference. https://t.co/JA3kFnMiGG"
obama_27_800,2024-01-01 00:00:00,We’ve got to vote up and down the ticket like never before for Democratic candidates. Join me for a drive-in rally… https://t.co/OEoMGpm4sY
obama_27_801,2024-01-01 00:00:00,We can’t afford to be complacent. Not this time. Not in this election. Make a plan right now:… https://t.co/nuT97aOsNK
obama_27_802,2024-01-01 00:00:00,"We can’t just imagine a better future; we’ve got to fight for it and vote for it. If you haven’t voted yet, make sure to return your ballot in person or make a plan to vote at https://t.co/XdZz4dh82T. If you’ve already voted, text three friends to make sure they have a plan. https://t.co/5KX97XcxcE"
obama_27_803,2024-01-01 00:00:00,"RT @JoeBiden: If you can still vote early, then vote early today.

If you haven’t returned your absentee ballot yet, then return it today.…"
obama_27_804,2024-01-01 00:00:00,"Today is the first day of Open Enrollment. If you need coverage or want to renew coverage, go to https://t.co/ob1Ynoesod right now and select a plan that works for you.

And then make sure you get out there and vote like your health care depends on it"
obama_27_805,2024-01-01 00:00:00,"RT @JoeBiden: Folks, there are just three days left to vote in this election, and we need your help to get people to the polls. Text three…"
obama_27_806,2024-01-01 00:00:00,Shoot your shot. https://t.co/XdZz4dh82T https://t.co/elpBmzu6hV
obama_28_807,2024-01-01 00:00:00,Fired up to be with my friends @StevieWonder and @JoeBiden in Detroit to make sure everybody turns out to vote in this election. Tune in live. https://t.co/dKNrWyVBKz
obama_28_808,2024-01-01 00:00:00,"Three days, Michigan. Three days until the most important election of our lifetimes. Join me and @JoeBiden for our first car rally together from Flint. https://t.co/nwvaSjUV5h"
obama_28_809,2024-01-01 00:00:00,You could be the difference between someone making it out to the polls or staying home. And many states could be decided by a handful of votes. Join me and make some calls for Joe in the last few days of this election: https://t.co/FZknijCx0E https://t.co/XGUnAArRXW
obama_28_810,2024-01-01 00:00:00,Always great talking to @KingJames and @MavCarter about everything from this unique NBA season to the importance of voting in every election. Tune in tonight and make your plan to vote: https://t.co/7zfJnABzx1 https://t.co/23pBshMb6s
obama_28_811,2024-01-01 00:00:00,"Second, volunteer"
obama_28_812,2024-01-01 00:00:00,"If you're wondering how you can support @JoeBiden in these final days of the campaign, here are two ways you can help. First, donate what you can. It’ll help the team reach the voters we most need to connect with: https://t.co/EZ5oiDW6V8"
obama_28_813,2024-01-01 00:00:00,"What we do in these next four days will not just decide the next four years, but the future of this country. Let’s choose hope over fear. I’m counting on you. https://t.co/vqV8csNVI9"
obama_28_814,2024-01-01 00:00:00,"An important reminder as millions of folks across the country vote early or make plans to vote on November 3: You have the right to vote. If you run into any issues at your polling place, call 1-866-687-8683 or your voter protection hotline. https://t.co/EKzZvdZVQt"
obama_28_815,2024-01-01 00:00:00,"If we pour all our effort into these last five days and vote up and down the ticket like never before, then we will elect @JoeBiden and @KamalaHarris. And we will leave no doubt about who we are and what this country stands for. Let's go. https://t.co/RSw1Dib5Xh"
obama_28_816,2024-01-01 00:00:00,"Here are some helpful tips about voting in person this year. Do vote early if you can, don't get out of line, and a couple of other important reminders. If you're voting by mail, now is the time to drop off your ballot at a drop box or an election office. https://t.co/NQFkNd2ppT"
obama_28_817,2024-01-01 00:00:00,"Thanks for making your voice heard, Adam. I know a thing or two about being hopeful in the rain, too. https://t.co/hBMNHE9dYo"
obama_28_818,2024-01-01 00:00:00,"This right here is what it's all about. Tell your mom thank you for voting, Leta."
obama_28_819,2024-01-01 00:00:00,"Stella, thank you for being a poll worker. You’re making a difference and helping folks cast their ballot safely."
obama_28_820,2024-01-01 00:00:00,"RT @JoeBiden: With one week left until Election Day, I'm delivering remarks in Warm Springs, Georgia, on how we can unite to address the cr…"
obama_28_821,2024-01-01 00:00:00,We’ve only got one week left in this election. I’m in Orlando for @JoeBiden to get more folks to vote and use their voices to determine the direction of our country. Let's go. https://t.co/7yPen5a2bu
obama_28_822,2024-01-01 00:00:00,"In Miami this weekend, I dropped by The Shop to talk with @KingJames and @MavCarter about the NBA bubble, the racial justice movement, and what's at stake over these next seven days.

Do not give up your power. Make a plan to vote: https://t.co/7zfJnABzx1 https://t.co/2Gjf5L9avl"
obama_28_823,2024-01-01 00:00:00,"Republicans love to say right before an election that they’ll protect preexisting conditions. Well, Joe and I actually did it"
obama_28_824,2024-01-01 00:00:00,"In the middle of a pandemic, this administration is trying to dismantle the Affordable Care Act in the Supreme Court. Here’s how Joe and I fought to expand health care, protect millions of Americans with preexisting conditions, and actually get it done: https://t.co/U9RbHRLPBw"
obama_28_825,2024-01-01 00:00:00,"Felicidades, Sofia"
obama_28_826,2024-01-01 00:00:00,"Dawn, you're showing us all how it's done"
obama_28_827,2024-01-01 00:00:00,"To anyone considering sitting this election out, look at this image. Then make a plan to vote. You're an inspiration to all of us, Brian"
obama_28_828,2024-01-01 00:00:00,"Eight months into the pandemic, as new cases are breaking records, we need an administration that’s not going to wave the white flag. A year ago today, @JoeBiden was talking about the leadership we need to get prepared for a pandemic, and he’s got a plan to get it under control."
obama_28_829,2024-01-01 00:00:00,"In 2020, we show up early"
obama_28_830,2024-01-01 00:00:00,"Hello, Florida! It's #VoteEarlyDay and we’re just 10 days away from this election. I want to see you make a plan today for how you’re going to get involved and vote. Let’s get to work. https://t.co/lq3jqYjrOX"
obama_28_831,2024-01-01 00:00:00,One election won't make everything perfect
obama_28_832,2024-01-01 00:00:00,"We’re just days away from the election and I know there are a lot of good lawyers out there who want to make sure that voting is safe, secure, and accessible for everybody. If that’s you, I hope you’ll sign up with @WeTheAction to protect the vote: https://t.co/SCxnR0YJJl"
obama_28_833,2024-01-01 00:00:00,"Joe has the character and the experience to make our country better - but first, he needs your vote. Make a plan to vote right now and vote as early as you can. https://t.co/Q2RbOQZwv9 https://t.co/QxJWM6EAnW"
obama_28_834,2024-01-01 00:00:00,"And there’s a lot more on the ballot than voting for president. If you want more information about all the candidates and measures that’ll be on your ballot, this is a good place to start: https://t.co/Q5BUeMaOB5"
obama_28_835,2024-01-01 00:00:00,"I just voted by mail for @JoeBiden and @KamalaHarris. If you're planning on doing the same, follow all the instructions carefully, and drop it in the mail or at a ballot drop box right away. Here, I’ll show you: https://t.co/S4gg0B5RXN"
obama_29_836,2024-01-01 00:00:00,Great to be back in Philly today. I'm fired up and ready to go! https://t.co/6r3W4EyeFU
obama_29_837,2024-01-01 00:00:00,"13 days until the most important election of our lifetimes. And you don’t have to wait until November 3rd to cast your ballot. Make a plan, vote, and then help your friends and family make a plan at https://t.co/XdZz4dh82T. Let’s do this. https://t.co/kmpF2XtLkH"
obama_29_838,2024-01-01 00:00:00,RT @JoeBiden: Tune in as @BarackObama sits down with community leaders in Philadelphia to talk about what’s at stake in this election. http…
obama_29_839,2024-01-01 00:00:00,"Hello, Philly – it's great to be back!"
obama_29_840,2024-01-01 00:00:00,102 never looked better! Grateful for all the folks like your great aunt who continue to show up and vote in this important election.
obama_29_841,2024-01-01 00:00:00,"Participate and vote. It’s not always pretty – trust me, I know. But it’s how, bit by bit, we’ve made progress over generations. Go to https://t.co/Q2RbOQZwv9 to make your plan, then get some friends to join you. Let’s go."
obama_29_842,2024-01-01 00:00:00,"One of the most inspiring things about this year has been seeing so many young people organizing, marching, and fighting for change. And to change the game on any of the issues we care about, we've got to vote for @JoeBiden and @KamalaHarris. https://t.co/vfHnP4XPxK"
obama_29_843,2024-01-01 00:00:00,"RT @Complex: Pull Up & Vote Party 🗳🇺🇸 TONIGHT at 9 PM ET.

The biggest names of today. The biggest vote of our lifetime.

Join us, @BarackO…"
obama_29_844,2024-01-01 00:00:00,RT @TheDemocrats: We want to make sure you have all the information you need to cast your ballot in this election. Watch this video from @B…
obama_29_845,2024-01-01 00:00:00,Bob Bauer and @JacklGoldsmith's new book is a thoughtful and comprehensive look at the issues at stake as we debate the role of the presidency in the coming years. It's worth a read. https://t.co/k5rNGdvYR2
obama_29_846,2024-01-01 00:00:00,"From police reform to funding our schools, the officials with the most power to change the issues we care about in our communities are often found at the state and local levels. So educate yourselves up and down the ticket, make a plan to vote, and vote: https://t.co/70CqTO5Gbf https://t.co/6z2c7HZ7H4"
obama_29_847,2024-01-01 00:00:00,".@PeteSouza was always there to document every moment of my presidency, from high-stakes meetings with world leaders to quiet mornings reading briefing memos. The @WayISeeItFilm is one to watch"
obama_29_848,2024-01-01 00:00:00,"Democrats winning control of the Senate will make all the difference on how much progress we can achieve on health care, supporting working families, and more. Join @CatherineForNV and me for today's grassroots event: https://t.co/E8GiJouVsF"
obama_29_849,2024-01-01 00:00:00,"Nobody should have to wait 11 hours to vote, but we’re all grateful that you"
obama_29_850,2024-01-01 00:00:00,There’s still so much work to do to make our communities safe and supportive for everybody. Elected officials can join us by taking the @MBK_Alliance’s Reimagining Policing Pledge: https://t.co/HAe2kKV0Lt
obama_29_851,2024-01-01 00:00:00,"In Evanston, IL, Northwestern University faculty and students worked with their police department to develop recommendations to change the city’s use of force policy and improve training and accountability standards.
https://t.co/uQ02pIcJbC"
obama_29_852,2024-01-01 00:00:00,"In Washtenaw County, MI, the new Task Force on 21st Century Policing will include community members, faith and nonprofit leaders, and mental health professionals. Plus, residents will be a part of the selection process for new officers.
https://t.co/OFNhY7IQJ6"
obama_29_853,2024-01-01 00:00:00,"In Madison, WI, community groups will now choose the members of a new civilian police oversight board, which must include at least one member who was previously incarcerated.
https://t.co/aYRRBAR9hm"
obama_29_854,2024-01-01 00:00:00,"In June, I called on elected officials across the country to work with their communities to take steps to review and reform their use of force policies. Already, we’re seeing progress:"
obama_29_855,2024-01-01 00:00:00,We've only got 20 days to go until Election Day – and we've got to vote for @JoeBiden and Democrats up and down the… https://t.co/BHsBZvz0hb
obama_29_856,2024-01-01 00:00:00,".@JohnBrennan is one of the hardest-working, most patriotic public servants I’ve ever seen, and our country is better off for it. As president, he was one of my closest advisors and a great friend. And in his memoir, Undaunted, you’ll see why. I hope you’ll read it. https://t.co/d9txQZ8G81"
obama_29_857,2024-01-01 00:00:00,This article is worth a read to learn more about why you should respond and what makes the 2020 Census different: https://t.co/jVcF5moPSZ
obama_29_858,2024-01-01 00:00:00,Complete the Census before it's too late
obama_29_859,2024-01-01 00:00:00,"There's a lot at stake in this election. From getting this pandemic under control to building a fairer economy to taking on climate change and protecting our health care, your vote can make all the difference. Register today and make a plan to vote early: https://t.co/Q2RbOQZwv9 https://t.co/chf7XoUwoA"
obama_29_860,2024-01-01 00:00:00,"RT @JoeBiden: Health care is deeply personal to me. And I guarantee you that if I'm elected president, I will protect your family's health…"
obama_29_861,2024-01-01 00:00:00,"And congratulations to my friend Alex Smith, for fighting back from a life-threatening injury to start at quarterback again for the Washington Football Team. It’s a testament to his strength, determination and the love and support of his family."
obama_29_862,2024-01-01 00:00:00,"Proud of my friend @KingJames for his fourth title, fourth Finals MVP, and for not only living up to the hype after seventeen seasons, but surpassing it as an extraordinary leader both on the court and in the public arena fighting for education, social justice, and our democracy. https://t.co/2IB3ZDI4Nf"
obama_29_863,2024-01-01 00:00:00,Congrats to the @Lakers and @Seattlestorm on their championship wins! Proud of all the NBA and WNBA teams and players who've been using their platforms to take a stand for racial justice and encourage civic participation this season.
obama_29_864,2024-01-01 00:00:00,"Join me for a conversation with @EricHolder and @allontheline. We’ll be talking about what’s at stake in this year’s election, the redistricting process, and ways to get involved in the fight to strengthen our democracy.
https://t.co/fm6spO4xHJ"
obama_29_865,2024-01-01 00:00:00,"RT @allontheline: 💥 TONIGHT AT 5:30 PM ET 💥

Don’t miss our grassroots event with President @BarackObama and AG @EricHolder! They’ll be dis…"
obama_30_866,2024-01-01 00:00:00,"A couple years ago, I met some promising young men working to prevent gun violence with @ChicagoCred. Talking with them reminded me that one of the best ways to make our communities safer is simple: Listen to"
obama_30_867,2024-01-01 00:00:00,And make sure you watch his full speech
obama_30_868,2024-01-01 00:00:00,We have the opportunity to elect a leader who will unify this nation. And that leader is @JoeBiden. We don't have a moment to waste. https://t.co/Q2RbOQZwv9 https://t.co/rau5qvJyZf
obama_30_869,2024-01-01 00:00:00,It’s going to take a lot of big-thinking and innovation to save the one planet we’ve got
obama_30_870,2024-01-01 00:00:00,"There's so much at stake in this election––and millions of Americans have already started voting. If you haven't already, make a plan to join them right now. Visit https://t.co/Q2RbOQZwv9 to get all the information you need to vote safely and securely in your state. Let's go."
obama_30_871,2024-01-01 00:00:00,"Last night, @KamalaHarris shared how she will work with @JoeBiden to protect the Affordable Care Act and build on it so every American has access to quality, affordable care."
obama_30_872,2024-01-01 00:00:00,"Right in the middle of a pandemic it failed to control, this administration is trying to get the Supreme Court to eliminate preexisting conditions protections for more than 100 million Americans. https://t.co/HhmSgOgRc3"
obama_30_873,2024-01-01 00:00:00,"RT @MichelleObama: Strong. Honest. Clear. Hopeful. Tonight, @KamalaHarris proved that she and @JoeBiden have what it takes to move this cou…"
obama_30_874,2024-01-01 00:00:00,#ImVotingFor the future of our democracy
obama_30_875,2024-01-01 00:00:00,.@JoeBiden has a plan to build our country back better and create millions of jobs
obama_30_876,2024-01-01 00:00:00,This is as powerful an argument as I’ve heard about the stakes of this election. Watch it. Share it. And get everyone you know to vote for @JoeBiden. https://t.co/XdZz4dh82T
obama_30_877,2024-01-01 00:00:00,"States across the country have voter registration deadlines coming up––and many of them are today. Do your part to protect this democracy and change our country for the better. Register or check your registration, and make a plan to vote: https://t.co/Q5BUeMaOB5 https://t.co/YNgC4G1Llo"
obama_30_878,2024-01-01 00:00:00,"Obviously, we’re in the midst of a big political battle right now, and while there’s a lot at stake, let’s remember that we’re all Americans. We’re all human beings. And we want everyone to be healthy, no matter our party."
obama_30_879,2024-01-01 00:00:00,"Michelle and I hope that the President, First Lady, and all those affected by the coronavirus around the country are getting the care they need and are on the path to a speedy recovery."
obama_30_880,2024-01-01 00:00:00,"Last night, I surprised a group of first-time poll workers at the @NBA Finals. These @MoreThanAVote volunteers are stepping up to make sure this election runs safely and fairly in their communities –– and you can too by signing up to volunteer at https://t.co/Ge4XvvPwpW. https://t.co/7RHB5dIzuE"
obama_30_881,2024-01-01 00:00:00,I'm looking forward to catching up with @KamalaHarris and folks around the country at our grassroots fundraiser tomorrow to talk about what's at stake in this election. You still have time to join us! I hope to see you there: https://t.co/SEmQcX6u3z https://t.co/4JhaHTj1Ox
obama_30_882,2024-01-01 00:00:00,"Always look forward to watching the NBA Finals––and tonight I had the chance to thank a great group of first-time poll workers with @morethanavote.

It’s critical that everybody votes in this election––by mail or in person if you can. Register to vote at https://t.co/d5gaMVt7hl. https://t.co/KgW5DAxnvn"
obama_30_883,2024-01-01 00:00:00,Joe knows this isn’t about him
obama_30_884,2024-01-01 00:00:00,"I’m proud to endorse these outstanding Democratic candidates who will work to get the virus under control, rebuild the economy and the middle class, and protect Americans’ health care and preexisting conditions protections. Support these candidates––and vote early if you can. https://t.co/KETni3uwBt"
obama_30_885,2024-01-01 00:00:00,You don't need me to tell you what's at stake in this election. Now is the time to show up and vote like never before to elect Democratic candidates up and down the ballot. Educate yourself on the candidates running and vote: https://t.co/Q2RbOQZwv9 https://t.co/DifTbqUYo1
obama_30_886,2024-01-01 00:00:00,"All right, let's try something new. If you’re in the United States, send me a text at 773-365-9687"
obama_30_887,2024-01-01 00:00:00,"Your vote has never mattered more than it does right now.

Today is National Voter Registration Day. Go to https://t.co/XdZz4dh82T to register and make a plan to vote. And make sure everybody you know does, too. https://t.co/ItarX1d4zw"
obama_30_888,2024-01-01 00:00:00,"Justice Ruth Bader Ginsburg fought to the end, through her cancer, with unwavering faith in our democracy and its ideals. That’s how we remember her. But she also left instructions for how she wanted her legacy to be honored. My statement: https://t.co/Wa6YcT5gDi"
obama_30_889,2024-01-01 00:00:00,"If you're looking for a way to get involved in this upcoming election, sign up to volunteer as a poll worker for early voting and Election Day. You can help your community and make sure this election runs fairly and safely. Sign up: https://t.co/Ge4XvvPwpW https://t.co/wb4Ap7xmtt"
obama_30_890,2024-01-01 00:00:00,"There’s no feeling like finishing a book, and I’m proud of this one. In A Promised Land, I try to provide an honest accounting of my presidency, the forces we grapple with as a nation, and how we can heal our divisions and make democracy work for everybody. https://t.co/T1QSZVDvOm"
obama_30_891,2024-01-01 00:00:00,"Over the last few months, I've learned a thing or two from the young people in our country. I figured I would return the favor by sharing with you how to make a plan to vote in this upcoming election.
 
Get registered and vote early: https://t.co/Q5BUeMaOB5 

Video: @attn https://t.co/CNqjS7Dmxo"
obama_30_892,2024-01-01 00:00:00,"Today we remember the lives we lost on 9/11. Even the smallest act of service is a way to honor them. And just like Jay Winuk, we can honor their memories through service. https://t.co/BdKDozK5t0"
obama_30_893,2024-01-01 00:00:00,The fires across the West Coast are just the latest examples of the very real ways our changing climate is changing our communities. Protecting our planet is on the ballot. Vote like your life depends on it
