id,date,text
obama_59_1749,2016-07-25 00:00:00,Add your name if you think we need common-sense legislation to prevent gun violence. https://t.co/u5ACT4qt8v #DisarmHate
obama_59_1750,2016-07-25 00:00:00,Actively ignoring this epidemic is unacceptable. Congress has to act. #DisarmHate https://t.co/n46r7RDnQI
obama_59_1751,2016-07-25 00:00:00,RT @FactsOnClimate: Announcing the sequel to the #ParisAgreement
obama_59_1752,2016-07-25 00:00:00,Add your name if you believe Senate leaders need to put aside partisan politics and fill the Supreme Court vacancy. https://t.co/tnioCrRvkC
obama_59_1753,2016-07-25 00:00:00,Restoring the Supreme Court to full strength must remain above Senate leaders' petty politics. #DoYourJob https://t.co/H5EWm5gQug
obama_59_1754,2016-07-25 00:00:00,The federal minimum wage hasn't been raised since 2009. $7.25 isn't enough to make ends meet
obama_59_1755,2016-07-23 00:00:00,"""Our economy is stronger today than it was before the crisis."""
obama_59_1756,2016-07-23 00:00:00,"In the weekly address, @SenWarren joins President Obama to discuss economic progress and Wall Street reform. https://t.co/u441ol4m3B"
obama_59_1757,2016-07-22 00:00:00,Add your name if you believe Senate leaders need to put aside partisan politics and fill the Supreme Court vacancy: https://t.co/aYkFs9IzS7
obama_59_1758,2016-07-22 00:00:00,A reminder for Senate leaders: Judge Garland has had strong bipartisan support in the past. #DoYourJob https://t.co/dFjboU0TYX
obama_59_1759,2016-07-21 00:00:00,Ida is one of the millions of people getting new opportunities to go solar and save money. Find out more: https://t.co/GTDwZu2lNT
obama_59_1760,2016-07-21 00:00:00,Our economy is making real progress. https://t.co/xBgqyYEoG0
obama_59_1761,2016-07-21 00:00:00,"By almost every economic measure, our economy is better off than it was eight years ago. https://t.co/iWSkzgSIkG"
obama_59_1762,2016-07-21 00:00:00,America’s businesses have created more than 14 million new private-sector jobs over 76 straight months. https://t.co/e4a5X2bv0j
obama_59_1763,2016-07-20 00:00:00,"For three years in a row, heat records have been broken across the globe. We have to #ActOnClimate now. https://t.co/Ps1Dk0Asqx"
obama_60_1764,2016-07-20 00:00:00,"RT @WhiteHouse: FACT: Since @POTUS took office more than 50,000 workers have been trained to enter the solar industry #ActOnClimate https:/…"
obama_60_1765,2016-07-20 00:00:00,Make your voice heard: The Senate must fill the vacancy on the Supreme Court. https://t.co/GguLMpuUkq #DoYourJob
obama_60_1766,2016-07-19 00:00:00,Today marks 125 days since Judge Garland's nomination
obama_60_1767,2016-07-18 00:00:00,Editorial boards across the country are calling on Senate leaders to fill the Supreme Court vacancy. Read more: https://t.co/IArYejb7bN
obama_60_1768,2016-07-18 00:00:00,The majority of Americans believe Judge Garland should get a fair hearing
obama_60_1769,2016-07-18 00:00:00,Read President Obama's op-ed in the @WSJ on the need for Senate leaders to fill the #SCOTUS vacancy: https://t.co/CdCsAdSJlB #DoYourJob
obama_60_1770,2016-07-17 00:00:00,Happening now: President Obama is delivering a statement on the shooting in Baton Rouge. https://t.co/51KA2cvfHk
obama_60_1771,2016-07-15 00:00:00,Happening now: President Obama is delivering remarks at the Diplomatic Corps Reception. https://t.co/0UeX55Gijc
obama_60_1772,2016-07-14 00:00:00,Tonight: President Obama joins a town hall discussion on communities and policing. Watch at 8 p.m. ET on @ABC: https://t.co/TeFybh04PX
obama_60_1773,2016-07-14 00:00:00,Stay in touch with the latest news
obama_60_1774,2016-07-14 00:00:00,Check out @VP Biden on the Supreme Court vacancy and Senate Republicans’ continued obstruction. https://t.co/HY8W77Ky1J #DoYourJob
obama_60_1775,2016-07-13 00:00:00,Watch President Obama deliver remarks at the #DallasMemorial service yesterday. https://t.co/BHIQTdnIDr
obama_60_1776,2016-07-12 00:00:00,President Obama is delivering remarks at an interfaith memorial service for the fallen police officers in Dallas. https://t.co/10WxYmaIke
obama_60_1777,2016-07-12 00:00:00,"At 1:40 p.m. ET, President Obama will be speaking at a memorial service for the fallen police officers in Dallas. https://t.co/mSqpIVvZzZ"
obama_60_1778,2016-07-08 00:00:00,"RT @WhiteHouse: ""We stand united with the people and the police department in Dallas."""
obama_60_1779,2016-07-07 00:00:00,"RT @WhiteHouse: At 6:35pm ET, @POTUS will speak on the reports of police shootings in Louisiana and Minnesota. Tune in: https://t.co/h292HS…"
obama_60_1780,2016-07-04 00:00:00,Happy Fourth of July. https://t.co/AQHiti7Yye
obama_60_1781,2016-07-03 00:00:00,"""Just imagine the peace and justice that would be possible in our world if we all lived a little more like Elie Wiesel."""
obama_60_1782,2016-07-02 00:00:00,Watch President Obama share a #FourthOfJuly message in the weekly address. https://t.co/7S5VzgA4OM
obama_60_1783,2016-07-01 00:00:00,Millions of Americans believe the Senate should hold a fair hearing for Judge Garland. Are you one of them? https://t.co/y5zGBXLvZZ
obama_60_1784,2016-07-01 00:00:00,"Nationwide, editorial boards agree that Senate leaders should get to work and hold a fair hearing for Judge Garland. https://t.co/y7tYvcyILv"
obama_60_1785,2016-07-01 00:00:00,Chicago raising its minimum wage is another reminder: Congress needs to keep up and #RaiseTheWage for hard-working Americans nationwide.
obama_60_1786,2016-07-01 00:00:00,Congrats to Chicago and all those who fought to #RaiseTheWage. Boosting paychecks for hard-working Americans is the right thing to do.
obama_60_1787,2016-07-01 00:00:00,Don't let the facts get drowned out. Join the OFA Truth Team today: https://t.co/RgBRNLYdYl https://t.co/SN8HUXw2H4
obama_60_1788,2016-07-01 00:00:00,"Since #Obamacare passed, health care spending has been slowing"
obama_60_1789,2016-07-01 00:00:00,"We can do more than thoughts, prayers, and moments of silence. Add your voice to call on Congress to #DisarmHate. https://t.co/6CiFxUwwD7"
obama_60_1790,2016-06-30 00:00:00,Stretch it out and get ready
obama_60_1791,2016-06-30 00:00:00,An overwhelming majority of Americans agree
obama_60_1792,2016-06-30 00:00:00,Reach out and help build this movement
obama_61_1793,2016-06-30 00:00:00,"After Monday's #SCOTUS ruling, more unconstitutional restrictions on women's reproductive rights are falling. https://t.co/q6D3sbHEpq"
obama_61_1794,2016-06-29 00:00:00,Add your name if you agree: Climate change is real and it's going to take global action to tackle it. https://t.co/HC4QGNDFWC #ActOnClimate
obama_61_1795,2016-06-29 00:00:00,A new historic goal in the fight to #ActOnClimate. https://t.co/sAu2fHdxAb
obama_61_1796,2016-06-28 00:00:00,Speak up and demand that Congress act on gun violence prevention: https://t.co/pA6IzzIE5A #DisarmHate
obama_61_1797,2016-06-28 00:00:00,Enough has been enough for a long time. Congress needs to vote on sensible gun legislation now. #DisarmHate https://t.co/twRQQnTBvK
obama_61_1798,2016-06-28 00:00:00,"Congratulations to D.C., and thanks to Mayor Bowser and the D.C. Council for fighting to #RaiseTheWage. https://t.co/7cXBVUFCmn"
obama_61_1799,2016-06-28 00:00:00,"""She outworked her rivals ... and became a role model to millions of Americans"
obama_61_1800,2016-06-27 00:00:00,You don't need super powers to help push progress forward. Chip in today: https://t.co/yCxp5APr5E https://t.co/iHbjSMt3Ug
obama_61_1801,2016-06-27 00:00:00,RT @SecretaryJewell: Today we celebrate Stonewall National Monument & all those who made the 1st LGBT monument possible.SJ #FindYourPark ht…
obama_61_1802,2016-06-27 00:00:00,Today's #SCOTUS ruling reaffirms that every woman has a right to make her own reproductive choices. https://t.co/uvgc9MgX3e
obama_61_1803,2016-06-27 00:00:00,Say you'll keep fighting to protect a woman's right to make her own reproductive choices. https://t.co/pkbjaxm9wO
obama_61_1804,2016-06-27 00:00:00,The Supreme Court just struck down Texas' overly restrictive abortion laws
obama_61_1805,2016-06-27 00:00:00,RT @PPact: This is a win for Texans & women across the country who need access to abortion. https://t.co/UEatutANNk #MyDecision https://t.c…
obama_61_1806,2016-06-27 00:00:00,Love only wins when people like you stand up and fight for it. Are you in? https://t.co/bHtizDnaTY #LoveIsLove
obama_61_1807,2016-06-26 00:00:00,We must keep working toward an America free from discrimination against LGBT individuals. #LoveIsLove https://t.co/YxdiL21fIl
obama_61_1808,2016-06-26 00:00:00,President Obama designates the first national monument honoring the LGBT rights movement. https://t.co/vpPSEnyXV6 #LoveIsLove
obama_61_1809,2016-06-26 00:00:00,Wear your love with pride. https://t.co/6863wUsjbn #LoveIsLove https://t.co/efRPdSb0dk
obama_61_1810,2016-06-26 00:00:00,"""We can’t rest. We’ve got to keep pushing for equality and acceptance and tolerance."""
obama_61_1811,2016-06-26 00:00:00,Marriage equality is one year old. But we still have a long way to go for full equality. #LoveIsLove https://t.co/nwM1XFHKzG
obama_61_1812,2016-06-26 00:00:00,Stand in solidarity with LGBT Americans
obama_61_1813,2016-06-25 00:00:00,We've made enormous progress toward full equality for LGBT Americans. Let's keep it going. #LoveIsLove https://t.co/x4mTOKQSiP
obama_61_1814,2016-06-25 00:00:00,"In the weekly address, President Obama discusses the Stonewall Inn's significance and the ongoing push for progress: https://t.co/FVKkSnnuCt"
obama_61_1815,2016-06-24 00:00:00,Take a look: @VP Biden discusses what 4-4 decisions
obama_61_1816,2016-06-24 00:00:00,"From gun violence prevention to LGBT rights, this grassroots movement is fighting for progress. Show your support: https://t.co/wc9gPY0h3G"
obama_61_1817,2016-06-24 00:00:00,"""Stonewall will be our first national monument to tell the story of the struggle for LGBT rights."""
obama_61_1818,2016-06-24 00:00:00,"A few words used by leading legal minds to describe Judge Garland:
Phenomenal
Exceptionally bright
Fair-minded https://t.co/BqmzlabZlZ"
obama_61_1819,2016-06-24 00:00:00,Think the Senate should give Judge Garland a fair hearing? Add your voice: https://t.co/iFQlY95TGt #DoYourJob
obama_61_1820,2016-06-24 00:00:00,"Because Senate leaders refuse to do their jobs, the Supreme Court cannot properly do its job. #DoYourJob https://t.co/DvqUdLN2pA"
obama_61_1821,2016-06-23 00:00:00,Speak up and demand that Congress act on gun violence prevention: https://t.co/Mo8ulIwRZg #DisarmHate
obama_61_1822,2016-06-23 00:00:00,Congress: Listen to the millions of voices demanding a vote on efforts to reduce gun violence. #DisarmHate https://t.co/X2uYxbJSs0
obama_62_1823,2016-06-23 00:00:00,"Our immigration system is broken, and we need Congress for a long-term solution"
obama_62_1824,2016-06-23 00:00:00,"RT @WhiteHouse: Watch → @POTUS on why today's #SCOTUS decision sets us back even further
on immigration reform: https://t.co/kdrhQQbPiS"
obama_62_1825,2016-06-23 00:00:00,LIVE: President Obama is speaking about today's Supreme Court immigration ruling. https://t.co/65QpzfLGS3 #ImmigrationAction
obama_62_1826,2016-06-23 00:00:00,We need more than moments of silence. We need action. And that's what's going on in the House now: https://t.co/L9m0dSfipA #NoBillNoBreak
obama_62_1827,2016-06-22 00:00:00,"RT @VP: Always the keeper of the nation's conscience at times of challenge and controversy. Thank you, John Lewis. https://t.co/D9CW2A3a2B"
obama_62_1828,2016-06-22 00:00:00,RT @repjohnlewis: My colleagues & I have had enough. We are sitting-in on the House Floor until we get a vote to address gun violence. http…
obama_62_1829,2016-06-22 00:00:00,The kind of obstruction we're seeing from Senate leaders is unprecedented. #DoYourJob https://t.co/W4TbswBwvS
obama_62_1830,2016-06-22 00:00:00,"If you're one of the millions of Americans who believes Judge Garland should get a fair hearing, add your voice: https://t.co/51SBeDdTKl"
obama_62_1831,2016-06-21 00:00:00,Judge Merrick Garland just received the American Bar Association's highest rating: https://t.co/9ew2WSpFqd
obama_62_1832,2016-06-21 00:00:00,Say you support decisive action to tackle climate change. https://t.co/S9gkxn0wpv #ActOnClimate
obama_62_1833,2016-06-21 00:00:00,Clean energy is here to stay. https://t.co/meQoPVWXtg
obama_62_1834,2016-06-21 00:00:00,"""There's something sacred about this place."""
obama_62_1835,2016-06-21 00:00:00,"RT @POTUS: Gun violence requires more than moments of silence. It requires action. In failing that test, the Senate failed the American peo…"
obama_62_1836,2016-06-20 00:00:00,Staying informed is too important leave to chance. Join the @OFA Truth Team today: https://t.co/ltq6xPBNfI https://t.co/6FQZXGLTHA
obama_62_1837,2016-06-20 00:00:00,Join @vj44 on a conference call to discuss efforts we can take to help reduce gun violence. https://t.co/AzL9CkYA7z
obama_62_1838,2016-06-20 00:00:00,"Take a look at President Obama's interview with @NatGeo on national parks, climate change and more. https://t.co/xtbFt2XMHI"
obama_62_1839,2016-06-19 00:00:00,"""To me, fatherhood means being there."""
obama_62_1840,2016-06-19 00:00:00,Happy Father's Day to all the dads out there. https://t.co/okqSRnQk6n
obama_62_1841,2016-06-18 00:00:00,"In the weekly address, the President talks about setting examples for children in light of tragedies like Orlando. https://t.co/B1k1FHYR76"
obama_62_1842,2016-06-18 00:00:00,"RT @WhiteHouse: ""These parks belong to all of us. This planet belongs to all of us. It’s the only one we’ve got"""
obama_62_1843,2016-06-18 00:00:00,President Obama has taken unprecedented steps to protect our land and water for future generations. https://t.co/D5PNr4itC5
obama_62_1844,2016-06-17 00:00:00,"This week, people all over the world came together to stand with the LGBT community"
obama_62_1845,2016-06-17 00:00:00,RT @VP: Taking steps to reduce gun violence worth doing if it could save one life. But it could save far more. Finish this. https://t.co/P7…
obama_62_1846,2016-06-17 00:00:00,RT @WhiteHouse: Today @POTUS & @VP visited Orlando. Watch the President give remarks after meeting with the families of the victims: https:…
obama_62_1847,2016-06-13 00:00:00,#OrlandoUnited https://t.co/ixCxMZzGH2
obama_62_1848,2016-06-12 00:00:00,"RT @WhiteHouse: ""In the face of hate and violence, we will love one another. We will not give into fear."""
obama_62_1849,2016-06-12 00:00:00,"RT @WhiteHouse: At 1:30pm ET, @POTUS will deliver a statement on the tragic shooting in #Orlando. Watch live: https://t.co/k6QWAbrHAh"
obama_62_1850,2016-06-10 00:00:00,"""Minds open. Hearts change. America shifts."""
obama_62_1851,2016-06-10 00:00:00,"Today, #LoveIsLove in all 50 states. But millions of Americans are still fighting to end discrimination"
obama_62_1852,2016-06-10 00:00:00,This is how you Slow Jam the News: https://t.co/bToPKW4UCM #POTUSonFallon
obama_63_1853,2016-06-10 00:00:00,RT @FallonTonight: .@POTUS and @jimmyfallon Slow Jam the News https://t.co/51BDe8zaca #POTUSonFallon #FallonTonight https://t.co/S64AtoY0tJ
obama_63_1854,2016-06-10 00:00:00,Watch President Obama Slow Jam the News on @FallonTonight at 11:35 p.m. ET. #POTUSonFallon https://t.co/RuwpGwbTSA
obama_63_1855,2016-06-08 00:00:00,Be proud of how far we've come
obama_63_1856,2016-06-07 00:00:00,Senate leaders' refusal to give Judge Garland a fair hearing is pure politics. #DoYourJob https://t.co/8rzLIBigzM
obama_63_1857,2016-06-07 00:00:00,Your support for a fair hearing and timely up-or-down vote to fill the vacancy on the Supreme Court matters: https://t.co/qfpOoUefet
obama_63_1858,2016-06-07 00:00:00,"Senate leaders' politicization of the Supreme Court is ""unconscionable."" https://t.co/f92L5TbGSR #DoYourJob"
obama_63_1859,2016-06-07 00:00:00,Love looks good on you. Wear it with pride: https://t.co/LlWSvS4uBE #LoveIsLove https://t.co/g5WjqYQvHq
obama_63_1860,2016-06-07 00:00:00,This month and every month. #LoveIsLove https://t.co/L3kRhhRxA4
obama_63_1861,2016-06-06 00:00:00,"Unemployment rate ⬇
Federal deficit ⬇
Uninsured rate ⬇ https://t.co/SGZTb0ZBf3"
obama_63_1862,2016-06-06 00:00:00,Watch as President Obama tackles four common myths about our economy. https://t.co/9DdBoFj9y2
obama_63_1863,2016-06-06 00:00:00,Former Energy Secretary @GovRichardson: Why the #TPP will make a difference in fighting climate change. https://t.co/AuWKEGJIGW
obama_63_1864,2016-06-06 00:00:00,"RT @FLOTUS: Together, we are stronger. Together we can change tomorrow. Stand with us: https://t.co/kMuWTuXTdb #StateOfWomen
https://t.co/m…"
obama_63_1865,2016-06-04 00:00:00,"""We pray that the greatest fighter of them all finally rests in peace."""
obama_63_1866,2016-06-03 00:00:00,The Supreme Court shouldn't be part of partisan political games. Add your name if you agree: https://t.co/j8T9Vqlffe
obama_63_1867,2016-06-03 00:00:00,It's time for Senate leaders to end the obstruction of our Supreme Court. #DoYourJob https://t.co/oKSLU2ADQi
obama_63_1868,2016-06-03 00:00:00,Make sure you have all the facts
obama_63_1869,2016-06-03 00:00:00,This is the largest annual global increase in renewable power capacity
obama_63_1870,2016-06-02 00:00:00,Watch: This is why people across the country have decided to #WearOrange today. https://t.co/IUguOJg2Zk
obama_63_1871,2016-06-02 00:00:00,Gun violence takes too many lives in our country. Congress must do something about it
obama_63_1872,2016-06-02 00:00:00,"This National Gun Violence Awareness Day, keep the pressure on Congress to act. #WearOrange https://t.co/VplJtSGMaU"
obama_63_1873,2016-06-02 00:00:00,"The noise around gun violence is loud.
But we can be louder.
#WearOrange https://t.co/lYA8JEFhvg"
obama_63_1874,2016-06-02 00:00:00,Join the thousands of people calling on Congress to do something about gun violence
obama_63_1875,2016-06-02 00:00:00,Gun violence takes far too many lives in America. Congress needs to act. #WearOrange https://t.co/TYqb1fklcu
obama_63_1876,2016-06-02 00:00:00,RT @POTUS: We cannot accept our level of gun violence as the new normal. We must take action to prevent this from happening again & again.…
obama_63_1877,2016-06-01 00:00:00,LAST CHANCE: Keep calm and enter before the midnight deadline. https://t.co/GRHmsl26Hd https://t.co/RJxiN938k8
obama_63_1878,2016-06-01 00:00:00,"RT @Everytown: June 2 is almost here!

How are you going to #WearOrange tomorrow? https://t.co/1y3ILsqdcu"
obama_63_1879,2016-06-01 00:00:00,Speak out against gun violence
obama_63_1880,2016-06-01 00:00:00,Don't miss your chance to meet President Obama this summer. Enter before tonight's deadline: https://t.co/GLFCABWEuq
obama_63_1881,2016-06-01 00:00:00,RT @WhiteHouse: “Our deficits haven’t grown these past seven and a half years; we’ve cut them by almost 75%.”
obama_63_1882,2016-06-01 00:00:00,This is progress
obama_64_1883,2016-06-01 00:00:00,"LIVE: President Obama is speaking in Elkhart, Indiana, highlighting America's economic progress. https://t.co/x8XPvevF8e"
obama_64_1884,2016-06-01 00:00:00,"Tune in at 3:25 p.m. ET to watch President Obama speak in Elkhart, Indiana"
obama_64_1885,2016-06-01 00:00:00,"""Make the choice to do some good in the world."" Watch Judge Garland speak to high school seniors at his alma mater: https://t.co/lkiWqSFra7"
obama_64_1886,2016-06-01 00:00:00,You don't want to miss out on this opportunity
obama_64_1887,2016-05-31 00:00:00,The Supreme Court shouldn't be part of partisan political games. Add your name if you agree: https://t.co/uqAYi3uxrI
obama_64_1888,2016-05-31 00:00:00,"Because some Senate leaders won't do their jobs, the Supreme Court can't fully do its job. #DoYourJob https://t.co/gxXi7wCfg0"
obama_64_1889,2016-05-31 00:00:00,Share a laugh with President Obama
obama_64_1890,2016-05-30 00:00:00,"""Today, and every day, let us remember the servicemen and women we have lost."""
obama_64_1891,2016-05-30 00:00:00,"""This Memorial weekend, I hope you’ll join me in acts of remembrance."""
obama_64_1892,2016-05-29 00:00:00,RT @SCOTUSnom: It's graduation day at Niles West High School! Watch Judge Garland speak live at 1pm ET: https://t.co/ta4ag8A0Ci https://t.c…
obama_64_1893,2016-05-27 00:00:00,A new survey shows that the overwhelming majority of #Obamacare customers are satisfied with their plans: https://t.co/75eFrBUV0e
obama_64_1894,2016-05-27 00:00:00,Join the @OFA Truth Team and help set the record straight on issues you care about: https://t.co/FgwDveu3Ef https://t.co/aCEFVLB0ko
obama_64_1895,2016-05-27 00:00:00,Enter now for the chance to get some pointers from the Commander-in-Chief. https://t.co/lGn4BecCBl https://t.co/XODRtQS0UI
obama_64_1896,2016-05-26 00:00:00,Stand up for a fair hearing and timely up-or-down vote for Judge Merrick Garland: https://t.co/DpeBdTFt8j
obama_64_1897,2016-05-26 00:00:00,"Judge Garland:

Independent mind ✓
Highly qualified ✓
Has had bipartisan support ✓

Senate leaders: #DoYourJob https://t.co/r2egTausVA"
obama_64_1898,2016-05-26 00:00:00,Tell your friends you fist bumped President Obama
obama_64_1899,2016-05-25 00:00:00,Senate leaders' obstruction of our Supreme Court is completely unprecedented. #DoYourJob https://t.co/PvubG4dFnd
obama_64_1900,2016-05-25 00:00:00,Senate leaders need to stop obstructing our Supreme Court
obama_64_1901,2016-05-25 00:00:00,Judge Garland was confirmed with bipartisan support in the past. He deserves a fair hearing. #DoYourJob https://t.co/TTcIByTScg
obama_64_1902,2016-05-25 00:00:00,Get some face time with President Obama. Enter now for your chance to meet him: https://t.co/rLstH6U5tU https://t.co/wqfAHCk5tN
obama_64_1903,2016-05-24 00:00:00,"If you think Senate leaders should do their jobs and fill the #SCOTUS vacancy, add your name now: https://t.co/nNHxp6SyII"
obama_64_1904,2016-05-24 00:00:00,Don't pass this up
obama_64_1905,2016-05-24 00:00:00,"""People want Senate to act on Supreme Court vacancy."" See what editorial boards are saying: https://t.co/qzMRbnjD0N #DoYourJob"
obama_64_1906,2016-05-24 00:00:00,Ever wished you could meet President Obama? Here's your chance. https://t.co/XCeXSFtCYg https://t.co/AeFMTtBdf9
obama_64_1907,2016-05-24 00:00:00,Judge Garland has one of the most impressive resumes of any Supreme Court nominee in recent history. https://t.co/r2egTausVA
obama_64_1908,2016-05-23 00:00:00,You don't want to miss out on this chance. Enter today: https://t.co/rED8cKIqv4 https://t.co/PJoHc0lIGF
obama_64_1909,2016-05-23 00:00:00,Editorial boards to senators: #DoYourJob and fill the Supreme Court vacancy. https://t.co/rJi8Fy57Ii
obama_64_1910,2016-05-23 00:00:00,"President Obama did his job, now it's time for the Senate to fulfill its duties"
obama_64_1911,2016-05-22 00:00:00,"On average, it's taken 67 days to confirm Supreme Court nominees since 1975. #DoYourJob https://t.co/ZqE3OngoFy"
obama_65_1912,2016-05-21 00:00:00,"""This week my administration took a step to help more workers get the overtime pay they’ve earned."""
obama_65_1913,2016-05-21 00:00:00,"In the weekly address, President Obama discusses expanding #overtime for millions of American workers: https://t.co/w7ytjIKedL"
obama_65_1914,2016-05-20 00:00:00,"This summer, you and a friend could meet President Obama. Here's how: https://t.co/OZslVlHMI1"
obama_65_1915,2016-05-20 00:00:00,Check out editorials from across the country calling on senators to fill the Supreme Court vacancy: https://t.co/4AGEWeXSIM #DoYourJob
obama_65_1916,2016-05-20 00:00:00,Editorial boards across the country are telling Senate leaders: #DoYourJob. https://t.co/WUkeoDslbp
obama_65_1917,2016-05-20 00:00:00,"Despite Judge Garland's qualifications, some Senate leaders still refuse to give him a hearing"
obama_65_1918,2016-05-19 00:00:00,The uninsured rate just hit 9.1 percent
obama_65_1919,2016-05-19 00:00:00,Don't miss this: https://t.co/NqqvCBukwi https://t.co/0Ud7rIqPa0
obama_65_1920,2016-05-19 00:00:00,"Thanks to the new #overtime rule, millions of hard-working Americans will have more economic security. https://t.co/JHQRJEcsv9"
obama_65_1921,2016-05-19 00:00:00,Stand up for middle-class workers
obama_65_1922,2016-05-18 00:00:00,Marriage equality? Affordable health care? Or economic progress? Tell him in person: https://t.co/5SqHi0htRp https://t.co/F83AdfUC8H
obama_65_1923,2016-05-18 00:00:00,RT @WhiteHouse: Today we're updating and strengthening #overtime pay rules to make sure millions more Americans are paid fairly. https://t.…
obama_65_1924,2016-05-18 00:00:00,Add your name if you support the Obama administration's new #overtime rule that expands protections for millions: https://t.co/9I8WHPmHlT
obama_65_1925,2016-05-18 00:00:00,LIVE: @VP Biden is speaking about the economy at @jenisicecreams headquarters in Ohio. https://t.co/JwIfgPAXfJ
obama_65_1926,2016-05-18 00:00:00,This is a big day for millions of middle-class workers. https://t.co/CCzAOOjxda
obama_65_1927,2016-05-18 00:00:00,LIVE: Senate Judiciary Democrats are holding a forum on Judge Merrick Garland. https://t.co/tT8pTk5Y54
obama_65_1928,2016-05-18 00:00:00,RT @WhiteHouse: BREAKING: @POTUS is taking an important step on #overtime to ensure your work is rewarded → https://t.co/R78XeeSNq9 https:/…
obama_65_1929,2016-05-17 00:00:00,Here's your chance: Tell President Obama what you're most thankful for
obama_65_1930,2016-05-17 00:00:00,"Judge Garland's former clerks have a lot to say about his record, work-life balance, and more"
obama_65_1931,2016-05-17 00:00:00,Senate leaders are continuing to obstruct a fair hearing for Judge Garland
obama_65_1932,2016-05-17 00:00:00,It's time for Senate leaders to put politics aside and fill the Supreme Court vacancy. #DoYourJob https://t.co/UAhLXYqgTN
obama_65_1933,2016-05-16 00:00:00,April was the seventh consecutive month of record-high temperatures. We need to #ActOnClimate. https://t.co/C4ca2VOA0a
